01-EA-000067,ST. PETER'S ACADEMY,DEL,"Centro Occidental,","Polangui, Albay",MF,CEAL,
01-DN-000294,ROOSEVELT COLLEGE (E/H)-CAINTA,DEL,"Sumulong Highway,","Cainta, Rizal", , ,
01-EC-000045,OUR LADY OF LA PORTERIA LEARNING CENTER,DEL,"(Frmly: Casa Isabelina L.C.)San antonio St.,","San Antonio St.,Calabanga 4405 , Camarines Sur", ,CEACAL,BACS
01-EC-000018,DOMINICAN SCHOOL OF CALABANGA,DEL,"(Formerly San Lorenzo Ruiz Cath. Sch.)Centro,","Calabanga, Camarines Sur",OP - Blessed Imelda,,Caceres
01-NF-000267,SACRED HEART OF JESUS CATHOLIC SCHOOL,DEL,(Frmly: Sta. Mesa Parochial School)4324 Old Sta. Mesa,"4324 Old Sta. Mesa, Manila", ,Manila,MAPSA
01-EC-000005,BLESSED NAME OF MARY LEARNING SCHOOL,DEL,"San Isidro,","Pili, Camarines Sur", , ,
01-EH-000003,ATENEO DE NAGA CHILD LEARNING CENTER,DEL,"John Phelan Drive, Km. 7, Pacol",Naga City, ,, 
01-EC-000077,ST. LOUISE DE MARILLAC - PILI,DEL,(formerly St. Catherine Laboure Sch.)Brgy.San Agustin ,"San Agustin, Pili, Camarines Sur",DC, ,BACS
01-NN-000603,ROOSEVELT COLLEGE (E/H)-10TH AVE.,DEL,"10th Avenue, P. Tuazon","Cubao, Quezon City", , ,
01-EA-000062,ST. LOUISE DE MARILLAC-TABACO,DEL,"(Formerly Catholic Central School)Ziga Ave.,","Ziga Ave., Tabaco, Albay",DC,CEAL,BACS
01-NG-000075/01-NG-000076,ROOSEVELT COLLEGE (E/HS)-MARIKINA,DEL,"J.P.Rizal St.,Lamuan","Lamuan, Marikina City", , ,
01-EC-000020,EVANGELICAL CHRISTIAN SCHOOL,DEL,"Canuto St.,San Juan,","Pili, Camarines Sur", , ,
01-OC-000052/01-OC-000053,ST. LOUIS - PACDAL (E/HS),DEL,Pacdal Road,"Pacdal, Baguio City",,BAGUIO,
01-NJ-000011/01-NJ-000012/01-NJ-000013,ESCUELA DE SAN LORENZO RUIZ(E/HS),DEL,"10 Sanchez Ave., Greenheights Village,","Sucat, Paranaque City",PISAP, ,
01-EH-000027,NAGA COLLEGE FOUNDATION,DEL,"M.T.Villanueva and Penafrancia Avenues,","Liboton St., Naga City", , ,
01-NO-000001,AQUINAS SCHOOL,DEL,"183 F.Blumentritt St.,kabayanan",San Juan City,OP DOMINICAN,,
01-EB-000008/01-EB-000009,CHUNG HUA HIGH SCHOOL (E/HS),DEL,"Zabala St.,","Daet, Camarines Norte", ,,
01-NL-000046,HOLY FAMILY PAROCHIAL SCHOOL,DEL,"East Capitol Drive,","Barrio Capitolyo, Pasig City",,PASIG,MAPSA
01-EH-000028,NAGA HOPE CHRISTIAN SCHOOL,DEL,"Panganiban Drive,Concepcion",Naga City, ,,
01-OC-000056,MARY IMMACULATE SCHOOL (E/H),DEL,"101 Upper General Luna Rd.,",Baguio City, ,,
01-EC-000069,ST. BRIGET'S SCHOOL,DEL,"Iriga Buhi Road,","Buhi, Camarines Sur",RGS, ,
01-EC-000016,COL. DEL SANTISIMO ROSARIO,DEL,Centro Libmanan ,"Libmanan, Camarines sur",OP-SIENA,,Libmanan
01-EA-000016,DOMINICAN SCHOOL-ALBAY,DEL,(Frmly: St. John's Academy),"Brgy. 2, Camalig, Albay",OP DOMINICAN,,
01-EC-000083,STA. CLARA COLLEGE,DEL,"(Frmly: STA. CLARA COLLEGE) Centro Tigaon,","Tigaon, Camarines sur",OP-SIENA,,BACS
01-OC-000019/01-OC-000074,DON BOSCO SCHOOL OF BAGUIO,DEL,Trancoville,Baguio City, ,BAGUIO,
01-EH-000001,ARBOVITAE PLAINS MONTESSORI,DEL,"Old GSIS Bldg., cor. Arana St. &","Barlin St., Naga City", , ,
01-EE-000001,HOLY CHILD EDUCATIONAL CENTER,DEL,"Highway 1, San Jose",Iriga City, , ,
01-EH-000040,UNIVERSIDAD DE STA. ISABEL (E/HS) - NIGHT CLASS,DEL,"Elias Angeles St.,",Naga City,,,
01-NF-000303/01-NF-000304,ST. JUDE COLLEGE-DIMASALANG (E/HS),DEL,"Don Quijote cor Dimasalang Sts.,","Sampaloc, Manila", , ,
01-NL-000116,STA. ROSA PAROCHIAL SCHOOL,DEL,"San Buenaventura St.,","Bagong Ilog, Pasig City",,PASIG,MAPSA
01-EA-000063,ST. MARY'S ACADEMY-LIGAO,DEL,"(Formerly St. Stephen's Academy)Binatagan,","Binatagan, Ligao, Albay",RVM,CEAL,BACS
01-EC-000025,HOLY CROSS PAROCHIAL SCHOOL,DEL,(Formerly Cedes Sapientiae Center),"Zone 1,San Miguel Nabua, Camarines Sur",,,
01-EH-000022,NAGA CENTRAL SCHOOL I,DEL,,Naga City,, ,
01-EA-000058,ST. BENEDICT ACADEMY,DEL,Poblacion,"Guinobatan, Albay",,,BACS
01-OC-000051,ST. LOUIS - AURORA HILL,DEL,"Ledesma St., Aurora Hill",Baguio City, ,BAGUIO,
01-OC-000060,ST. VINCENT PRE-SCHOOL,DEL,"Campo Filipino,","Naguilian Rd., Baguio City", , ,
01-EH-000045,BICOL STATE COLL OF APPLIED SCI. & TECH.,DEL,"Penafrancia Ave.,","Pe�afrancia Ave., Naga City",,,
01-OC-000038,NORTHRIDGE ACADEMY,DEL,"001 Carmella St.,","Upper Q.M. Barangay, Baguio City", , ,
01-EC-000051,PARTIDO STATE UNIV.-(LAB. H.S.),DEL,San Juan Bautista st,"Goa, Camarines Sur", , ,public
01-DN-000296,ROOSEVELT COLLEGE-SAN MATEO,DEL,"(Formerly Dona Aurora Mem'l H.S.)P.Ocampo St.,","P. Ocampo St., San Mateo, Rizal", , ,
01-OC-000073,YMCA PRE-SCHOOL,DEL,"Post Office Loop,",Baguio City, , ,
01-OC-000003,BAGUIO CATHEDRAL NURSERY SCHOOL,DEL,"Sangkabalayan Bldg.,Mount Mary ","Baguio Cathedral Loop, Baguio City", ,BAGUIO,
01-EA-000064,ST. MICHAEL ACADEMY,DEL,Iraya Sur,"Oas, Albay",OP-SIENA,,
01-EB-000032,ST. JOHN THE APOSTLE ACA.(E/H),DEL,Villaflores Street,"Labo, Camarines Norte",AMP,Daet,CANAPS
01-NF-000370/01-NF-000371,WESTMINSTER SCHOOL (E/HS),DEL,60-68 H. Lopez Boulevard,"Balut, Tondo, Manila", , ,
01-EC-000062,ROSARY LEARNING CENTER-BAAO,DEL,"19 J. Arroyo St., del Rosario,","Baao, Camarines Sur", ,, 
01-EC-000034,LITTLE THERESE PAROCHIAL SCHOOL,DEL,"Brgy.San Isidro,Pili","Pili, Camarines Sur", , ,
01-EC-000055,PILI PAROCHIAL SCHOOL,DEL,"San Antonio,","Pili, Camarines Sur", ,,Caceres
01-EC-000008,BULA PAROCHIAL SCHOOL,DEL,"St. Mary Magdalene Parish,Bula","Bula, Camarines Sur", ,,CaceresCEACAL
01-EC-000094,GLORIOUS ADONAI LEARNING ACADEMY,DEL,,, , ,
01-OC-000011,BAGUIO CITY SCIENCE FOUNDATION,DEL,"#6 Old Forestry Compound,Engineers Hill",Baguio City, , ,
01-EB-000005/01-EB-000045/01-EB-000048,CAMARINES NORTE STATE,DEL,Aba�o Campus 4600,"Daet, Camarines Norte",, ,
01-EC-000042,NEW ANGLO FILIPINO-CHINESE SCHOOL FDT.,DEL,"(Formerly Libmanan Anglo Chinese),Libod I","Libod I, Libmanan, Camarines Sur", , ,
01-EE-000019,"FATIMA INTEGRATED FARM SCHOOL, INC.",DEL,"Villa Felisima,Brgy. San Agustin,",Iriga City,,,
01-EG-000037,ST. ANTHONY HIGH SCHOOL SEMINARY,DEL,"Pulang Bato, Maligaw",Masbate City,,,
01-EB-000026/01-EB-000027,OUR LADY OF LOURDES COLL. FDTN (E/HS),DEL,"Vinzon's Ave.,","Daet, Camarines Norte", , ,
01-EA-000038,MARIAN FORMATION CENTER-ALBAY,DEL,"Nazareth  Child Formation Center, Panal","Panal, Tabaco, Albay",DM,Legazpi,
01-EC-000067,ST. ANDREW ACADEMY (HS),DEL,,"Sagnay, Camarines Sur",DM,,Caceres
01-EC-000074,ST. JOSEPH ACADEMY OF LIBMANAN,DEL,312 Potot,"Libmanan, Camarines Sur", ,,CNAPS
01-EC-000093,BICOL FOR CHRIST MISSION ACADEMY,DEL,,, , ,
01-EH-000015,KIDDY GARDEN SCHOOL,DEL,"157 Bagumbayan Norte,",Naga City, , ,
01-NG-000111,YOUNG GENIUS LEARNING CENTER,DEL,"(formerly Schola Antipolo Integrated,Inc.)131 Narra cor Champaca St.,","131 Narra cor Champaca St.,Marikina City",,,
01-NF-000277,SAN PABLO APOSTOL LRNG. CTR.- E. JACINTO,DEL,"2210 E. Jacinto St.,","Nepo-Magville, Tondo, Manila",FdCC - Sons ,,MAPSA
01-EB-000025,NEW EVE LEARNING CENTER,DEL,(Formerly Little Sunbeam LC)#2706 Jose Martinez St.,"Daet, Camarines Norte", ,,
01-EH-000016,LITTLE FLOWER N & K SCHOOL,DEL,"#45 Ateneo Ave.,",Naga City,DM,,
01-OC-000049,ST. ELIZABETH MONT. SCHOOL,DEL,"78 Upper General Luna Rd.,",2600 Baguio City,DML, ,
01-OC-000018,CHERUBIM PRE-SCHOOL,DEL,#189 SVP Housing Newsite,"Bakakeng, Baguio City", , ,
01-ED-000004,MARIANNE FORMATION CENTER,DEL,"Caramonan,","Virac, Catanduanes",DM, ,
01-EC-000089,TENDER LEARNING CENTER,DEL,"Dilanco Street,Libod #2","Libmanan, Camarines Sur", , ,
01-EH-000042,YOUNG THINKERSVILLE PRE-SCHOOL,DEL,"B-21 L-45&46 Villa,","Karangahan Subd., Naga City", , ,
01-DN-000434,"SCHOLA ANTIPOLO INTEGRATED, INC.",DEL,,, , ,
01-NC-000066,RIOTUBA NICKLE MININGS CORP.,MAG,"32nd St., NAC Tower","BGC, Taguig City", , ,
01-DK-000036,HOLY INFANT ACADEMY,MAG,"A. Bonifacio St., Ibaba East","Calapan City, Oriental Mindoro", ,APOSTOLIC VICARIATE OF CALAPAN, 
01-DJ-000005,DIVINE WORD COLL. OF SAN JOSE,MAG,"Gen. Lucban St.,","San Jose, Occidental Mindoro",SVD, , 
01-DK-000032/01-DK-000033,GOOD SHEPHERED ACADEMY (E/HS),MAG,"Strong Republic Nautical Highway,Poblacion II","Victoria, Oriental Mindoro", ,APOSTOLIC VICARIATE OF CALAPAN, 
01-DL-000058,PALAWAN STATE UNIV.-(LAB. E/H),MAG,"Tiniguiban,","Puerto Princesa City,", , ,
01-DL-000028/01-DL-000029,HOLY TRINITY COLLEGE (E/HS),MAG,"Quezon St.,",Puerto Princesa City,OP-SIENA,,
01-DL-000056,PALAWAN HOPE CHRISTIAN SCHOOL,MAG,"Manalo Ext.,",Puerto Princesa City, , ,
01-DJ-000029,SEMIRARA SCHOOL,MAG,Divine Word College of San Jose,"San Jose, Occidental Mindoro", , , 
01-DK-000020/01-DK-000021,DIVINE WORD COLL. OF CALAPAN (E/HS),MAG,"Governor Infantado St., Sta.Marica Village","Calapan City, Oriental Mindoro",SVD, , 
01-DI-000005,EDUCATIONAL SYSTEM TECH. INST.,MAG,"D. Reyes St., Murallon,","Boac, Marinduque", , ,
01-DJ-000003,COL. DE SAN SEBASTIAN (E/H),MAG,"Dangeros,","Sablayan, Occidental Mindoro", , , 
01-DK-000030,GLORIA CENTRAL SCHOOL,MAG,"Poblacion,","Gloria, Oriental Mindoro", , ,
01-DK-000073,PUERTO GALERA ACADEMY (E/HS),MAG,Poblacion,"Puerto Galera, Oriental Mindoro", , , 
01-DJ-000025,SAN JOSE ADVENTIST ACADEMY,MAG,"Mariano St., San Roque II,","San Jose, Occidental Mindoro",SDA-LSL, ,
01-DL-000088,WESTERN PHILIPPINES UNIVERSITY,MAG,"WPU, San Juan,","Aborlan, Palawan", , ,
01-DL-000078,ST. AUGUSTINE ACADEMY-(E/HS),MAG,"Coron-Busuanga Rd.,","Coron, Palawan",,,
01-DJ-000001,BETHANY CHRISTIAN LEARNING ACADEMY,MAG,"Bethany Learning Acad.-Labangan, Pob.","San Jose, Occidental Mindoro", , ,
01-DL-000073,SAN FRANCISCO JAVIER COLLEGE,MAG,Lapu-lapu St.,"Narra, Palawan",AR,,
01-DL-000052/01-DL-000053,PALAWAN ADVENTIST ACADEMY (E/HS)-NARRA,MAG,,"Tacras, Narra, Palawan",SDA-LSL, ,
01-DO-000025,VIRGINIA CENTURIONE BRACELLI SCH.,MAG,"Poctoy,","Odiongan, Romblon", , , 
01-DL-000045,LIFE COLLEGE,MAG,"(Life Renewal X'tian Acad.)Junction II,","San Pedro, Puerto Princesa City", , ,
01-DO-000026,ROMBLON ADVENTIST MISSION SCHOOL,MAG,"Dapawan,","Odiongan, Romblon",SDA-LSL,,
01-DO-000004,EPIPHANY SCHOOL OF PEACE AND GOODWILL,MAG,"J.P. Rizal St., Tabing Dagat,","PIC, Odiongan, Romblon", , ,
01-DK-000057,METAMORPHOSIS CHILD DEV'T & CARE,MAG,"Sta. Rita,","Pinamalayan, Oriental Mindoro", , ,
01-DK-000001/01-DK-000002,ABADA COLLEGE (E/HS),MAG,Western Nautical Highway,"Pinamalayan, Oriental Mindoro", , ,
01-DJ-000021/01-DJ-000022/01-DJ-000023,OCCIDENTAL MINDORO NATIONAL COLLEGE-E/HS,MAG,,"San Jose, Occidental Mindoro", , ,
01-DK-000083,SAN MARIANO ACADEMY (HS),MAG,"San Mariano,","Roxas, Oriental Mindoro", , ,
01-DK-000010,BANSUD INSTITUTE (HS),MAG,Poblacion,"Bansud, Oriental Mindoro", , ,
01-DI-000024,OUR MOTHER OF PERPETUAL SUCCOR ACAD.,MAG,"Poblacion,","Torrijos, Marinduque", , , 
01-DK-000023,EASTERN MINDORO COLLEGE,MAG,"Vicente Ilagan St.,","Bongabong, Oriental Mindoro", , ,
01-DK-000092,STO. NINO SCHOOL-ROXAS (E/HS),MAG,Brgy.Paclasan,"Roxas, Oriental Mindoro", , , 
01-DL-000097,KIDS WORLD LEARNING CENTER,MAG,,, , ,
01-DK-000007,ARK OF THE COVENANT MONTESSORI SCHOOL,MAG,"Poblacion I,","Victoria, Oriental Mindoro", , ,
01-DL-000072,SALVE REGINA SCHOOL,MAG,(Mary Mediatrix Child Formation),"Bancao-Bancao, Puerto Princesa City", , ,
01-DK-000063,NAUJAN ACADEMY (E/HS),MAG,"Mabini St.,Poblacion I","Naujan, Oriental Mindoro", , , 
01-DO-000009,HOLY ROSARY ACADEMY (E/HS),MAG,"Poblacion,","San Agustin, Romblon", , , 
01-DL-000067,PUERTO PRINCESA ADVENTIST ACADEMY,MAG,"#55 Fernandez St.,",Puerto Princesa City,SDA-LSL, ,PALAWAN ADVENTIST MISSION
01-DK-000081,SAN LORENZO RUIZ MONT.-CALAPAN,MAG,"226 Lalud,","Calapan City, Oriental Mindoro", , ,
01-DK-000009,BACO CATHOLIC SCHOOL (E/HS),MAG,Western Nautical Hwy,"Baco, Oriental Mindoro", ,APOSTOLIC VICARIATE OF CALAPAN, 
01-DL-000071,SACRED HEART OF JESUS HIGH SCH,MAG,Old Camp District I,"Brooke's Point, Palawan",AR,,
01-DJ-000020,MOTHER CATERINA SCHOOL,MAG,,"San Jose, Occidental Mindoro", , , 
01-DL-000040,PUERTO PRINCESA UNITED METHODIST H.S.,MAG,"(Joy Kiddie L.C.) 56-A Lacao St.,","Puerto Princesa City, Palawan", , ,
01-DK-000080,SACRED HEART ACADEMY (H/E),MAG,Poblacion,"Gloria, Oriental Mindoro", , , 
01-DK-000016,CLARENDON MONTESSORI,MAG,,"Roxas, Oriental Mindoro", , ,
01-DI-000027/01-DI-000028,ST. MARY'S COLL. OF MARINDUQUE (E/HS),MAG,(Formerly Imm. Concepcion College),"Boac, Marinduque",RVM, , 
01-DK-000089,ST. JOSEPH ACAD.-OR. MINDORO,MAG,"Bagong Bayan II,Bongabong,",Oriental Mindoro, , , 
01-DI-000006,ESCUELA DE GRATIA PLENA INC.,MAG,"Bonifacio St., Bagong Silang,","Sta. Cruz, Marinduque", , ,
01-DL-000008,BEULAH LAND CHRISTIAN SCHOOL,MAG,"Abad Santos St.,","Puerto Princesa City, Palawan", , ,
01-DI-000031,STA. CRUZ INSTITUTE,MAG,,"Sta. Cruz, Marinduque", , ,
01-DK-000095,JOELEY CHRISTIAN SCHOOL,MAG,Poblacion,"Roxas, Oriental Mindoro",,,
01-DK-000045,JOHN PAUL COLLEGE (E/HS),MAG,"M.G. Andaya Compound, Odiong","Roxas, Oriental Mindoro", , ,
01-DI-000007,HOLY INFANT SCHOOL,MAG,"Mabini St., Bryg. Pag-asa,","Sta. Cruz, Marinduque", , , 
01-DK-000037,IMM. HEART OF MARY ACADEMY,MAG,"Madrid Ave.,","Pinamalayan, Oriental Mindoro", ,APOSTOLIC VICARIATE OF CALAPAN, 
01-DK-000043,JIL CHRISTIAN SCHOOL-PINAMALAYAN,MAG,,"Pinamalayan, Oriental Mindoro", , ,
01-DK-000077,ROXAS CHRISTIAN KINDERGARTEN SCHOOL,MAG,"Villaresis St.,","Bagumbayan, Roxas, Oriental Mindoro", , ,
01-DK-000087,SOCORRO CENTRAL SCHOOL,MAG,,"Socorro, Oriental Mindoro", , ,
01-DK-000065,NORTHERN MINDORO ACADEMY,MAG,Parang Western Nautical Highway,"San Teodoro, Oriental Mindoro", , , 
01-DL-000018,EL MONTESSORI SCHOOL DE PALAWAN,MAG,"Cruz Subd.,Rizal Ave.Ext.,","Puerto Princesa City, Palawan", , ,
01-DK-000024,EASTERN MINDORO INST. OF SCI. & TECH.,MAG,(Frmly:EASTERN MINDORO INST OF SCI & TECH)Del Pilar St.,"Pinamalayan, Oriental Mindoro", , ,
01-DL-000075,SEMINARIO DE SAN JOSE,MAG,"Brgy. San Jose, Tiniguiban,",Puerto Princesa City, , ,
01-DJ-000009,GRACE CHRISTIAN SCHOOL-SAN JOSE,MAG,"Gen. Lukban St.,","San Jose, Occidental Mindoro", , ,
01-DO-000029,TINY TOUCH LEARNING CENTER,MAG,"Konnichiwa Bldg., Dapawan,",Odiongan Romblon,,,
01-DL-000081,ST. JOSEPH ACAD.-PALAWAN(HS),MAG,Rizal St.Tenga-Tenga,"Cuyo, Palawan", , ,
01-DK-000071,POLA CATHOLIC SCHOOL (E/H),MAG,Zone I,"Pola, Oriental Mindoro", , , 
01-DL-000013,CENTRAL PALAWAN ADVENTIST ACAD. (HS),MAG,"#55 Fernandez St.,","Puerto Princesa City, Palawan",SDA-LSL, ,
01-DL-000096,FAITH ADVENTIST ACADEMY,MAG,"San Antonio Diversion Rd.,","Poblacion, Taytay, Palawan",SDA-LSL, ,CAPS
01-DK-000012,CALAPAN CHU ENG SCHOOL,MAG,"Araceli St., Ilaya","Calapan City, Oriental Mindoro", , ,
01-DL-000023,FULLBRIGHT COLLEGE,MAG,"Km. 5 National Highway,","Brgy.San Jose, Puerto Princesa City", , ,
01-DK-000042,JIL CHRISTIAN SCHOOL-CALAPAN,MAG,"Bulusan,","Calapan City, Oriental Mindoro", , ,
01-DL-000057,PALAWAN POLYTECHNIC COLL.-E/HS,MAG,"Manalo Ext.,",Puerto Princesa City, , ,
01-DK-000044,JIL CHRISTIAN SCHOOL-VICTORIA,MAG,"Poblacion II,","Victoria, Orietal Mindoro", , ,
01-DJ-000031,STO. NINO MONTESSORI SCHOOL,MAG,"Marzan Village,","San Jose, Occidental Mindoro", , ,
01-DL-000037,JESUS THE DIVINE SON ACADEMY,MAG,"Purok Kaakbayan,","Brgy. Tiniguiban, Puerto Princesa City", , ,
01-DK-000035,HOLY CHILD MONTESSORI SCHOOL,MAG,Brgy. Sto. Nino,"Puerto Galera, Oriental Mindoro", , ,
01-DL-000092,EMMANUEL CHRISTIAN ACADEMY,MAG,"(formerly:EMMANUEL CHRISTIAN ACADEMY)Abueg St.,","Abueg St., Poblacion,Quezon, Palawan", , ,
01-DL-000080,ST. FRANCIS DE SALES PEDAGOGY SCHOOL,MAG,"BM Rd., San Pedro,","Puerto Princesa City, Palawan", , ,CAPS
01-DL-000016,CHRISTIAN LEARNING CENTER,MAG,"Siose Subd.,","San Jose, Aborlan, Palawan", , ,CAPS
01-DL-000005,ANGEL'S WORLD ACADEMY,MAG,"Lagan St.,","Puerto Princesa City, Palawan", , ,
01-DL-000032,IMM. CONCEPTION PAROCHIAL SCH.-QUEZON,MAG,"Poblacion,","Quezon, Palawan", ,,CAPS
01-DK-000075,ROSE OF SHARON LEARNING CTR.,MAG,,"Calapan City, Oriental Mindoro", , ,
01-DI-000011,MALINDIG INSTITUTE (E/HS),MAG,"Osmea St., lapu-lapu","Sta. Cruz, Marinduque", , ,
01-DO-000027,ADVENTIST MISSION ACADEMY OF ROMBLON,MAG,,,SDA-LSL, ,
01-DL-000094,PRECIOUS JEWELS CHRISTIAN SCHOOL,MAG,,, , ,
01-DK-000068,PENAVERDE MONTESSORI SCHOOL,MAG,,"Mansalay, Oriental Mindoro", , ,
01-DL-000049,NARRA ADVENTIST ELEMENTARY SCH,MAG,"Rizal Ave., corner Malvar St.,","Narra, Palawan",SDA-LSL, ,PALAWAN ADVENTIST MISSION
01-DK-000084,SCH. OF THE NATION,MAG,"Sabang,","Puerto Galera, Oriental Mindoro", , ,
01-DK-000090,STAR LEARNING CENTER,MAG,"Poblacion,","Bansud, Oriental Mindoro", , ,
01-DK-000072,PRINCE OF PEACE MONT. & COLLEGE,MAG,"Poblacion Balete,","Puerto Galera, Oriental Mindoro", , ,
01-DK-000034,GRACE MISSION COLLEGE,MAG,"Catiningan,","Socorro, Oriental Mindoro",, ,
01-DK-000040,JIL CHRISTIAN SCHOOL-BANSUD,MAG,"F.E. Marcos St., Poblacion,","Bansud, Oriental Mindoro", , ,
01-DL-000055,PALAWAN BETHEL BAPTIST ACADEMY,MAG,"delos Reyes Rd. II,","San Pedro, Puerto Princesa City,Palawan", , ,
01-DK-000011,BEULAH'S KIDDIE KOLLEGE,MAG,"Poblacion,","Bansud, Oriental Mindoro", , ,
01-DK-000059,MINA DE ORO CATHOLIC HIGH SCH.,MAG,"Zone III,","Socorro, Oriental Mindoro", , , 
01-DK-000093,"CLARION CALL LEARNING CENTER, INC.",MAG,"19I-192 Mampusti Ave.,","Poblacion, Bansud, Oriental Mindoro", , ,
01-DJ-000013,KNIGHTS OF COLUMBUS SCHOOL,MAG,"St. Joseph Parish Compound,","San Jose, Occidental Mindoro", , , 
01-DL-000100,FIRST FREE WILL BAPTIST CHRISTIAN SCHOOL,MAG,"Rizal Ave., Ext.,","Bancao-Bancao, Puerto Princesa City", , ,
01-DK-000050,LITTLE ANGELS OF MARY IMM. CHILDREN'S,MAG,"Ipil St., Cor. Roxas Drive, Lumangbayan,","Calapan City, Oriental Mindoro", , ,
01-DL-000098,ESTRELLA DEL NORTE ADVENTIST ELEM. SCH.,MAG,"Sorillo St., Poblacion","Taytay, Palawan",SDA-LSL, ,PALAWAN ADVENTIST MISSION
01-DI-000018,MARINDUQUE MIDWEST SCHOOL (HS),MAG,"Dili,","Gasan, Marinduque", , ,
01-DK-000096,NETHS VILLE ACADEMY,MAG,"Brgy. San Rafael,","Calapan City, Oriental Mindoro", , ,
01-DL-000043,KINDERWORLD ACADEMY,MAG,,, , ,
01-DJ-000011,HOLY FAMILY ACADEMY (E/HS),MAG,"Millsite I, Central,","San Jose, Occidental Mindoro", , , 
01-DL-000014,CHILDREN'S CHANCE FOR TOMORROW (CCFT),MAG,"Brgy. 6 Poblacion, Pali,","Coron, Palawan", , ,
01-DK-000061,MINDORO CHRISTIAN MONTESSORI,MAG,"Bayanan 1,","Calapan City, Oriental Mindoro", , ,
01-DK-000028,FRUITS OF FAITH SCHOOL,MAG,"Nacoco, San Vicente East,","Calapan City, Oriental Mindoro", , ,
01-DI-000008,LIGHTHOUSE MARITIME SCHOOL,MAG,(Lighthouse Learning Center),"Boac, Marinduque", , ,
01-DK-000086,SENTRO NG KARUNUNGAN NG LUMANGBAYAN,MAG,"Lumngbayan,","Calapan City, Oriental Mindoro", , ,
01-DL-000025,"GOLDEN VALLEY A/G LEARNING CENTER, INC.",MAG,"Purok Acacia, Golden Valley Subd.,","Sicsican, Puerto Princesa City", , ,
01-DK-000039,JIL CHRISTIAN SCHOOL-BACO,MAG,"Poblacion,","Baco, Oriental Mindoro", , ,
01-DK-000064,NAUJAN CHRISTIAN BAPTIST ACADEMY,MAG,"Pinagsabangan II,","Naujan, Oriental Mindoro", , ,
01-DI-000012,MARCOPPER HIGH SCHOOL,MAG,,"Sta. Cruz, Marinduque", , ,
01-DJ-000002,BEULAH LAND CHRISTIAN SCHOOL,MAG,"Asinan Rd.,","San Jose, Occidental Mindoro", , ,
01-DK-000038,INNOVATIVE COLL. OF SCIENCE & TECH.,MAG,,"Bangabong, Oriental Mindoro", , ,
01-DK-000085,SEED MISSION SCHOOL,MAG,"Papandayan,","Pinamalayan, Oriental Mindoro", , ,
01-DK-000076,ROXAS ADVENTIST SCHOOL,MAG,"Palayan St.,","Roxas, Oriental Mindoro", , ,
01-DJ-000008,FOUR SQUARE CHRISTIAN SCHOOL,MAG,Buenavista,"Sablayan, Occidental Mindoro", , ,
01-DL-000082,"ST. PAUL COLLEGE-CULION,PALAWAN",MAG,,"Culion, Palawan", , ,
01-DO-000006,FLORENTINO CHILDREN'S LEARNING CENTER,MAG,"Poblacion,","San Andres, Romblon", , ,
01-DL-000006,BAGONG SIKAT ADVENTIST ELEMENTARY SCHOOL,MAG,,,SDA-LSL, ,PALAWAN ADVENTIST MISSION
01-DO-000028,MONTFORT ACADEMY,MAG,"Brgy. Lohos,","Romblon, Romblon", , , 
01-DL-000007,BAPTIST CHRISTIAN SCHOOL,MAG,"cor Manalo  & Valencia Sts.,",Puerto Princesa City, , ,
01-DK-000015,CHILD'S PLACE KINDERGARTEN,MAG,"Poblacion,","Bansud, Oriental Mindoro", , ,
01-DK-000054,MANSALAY CATHOLIC SCHOOL,MAG,,"Mansalay, Oriental Mindoro", , , 
01-DI-000009,LITTLE STAR PRE-SCHOOL,MAG,"#42 Gov. D. Reyes St.,","Brgy. Murallon, Boac, Marinduque", , ,
01-DL-000099,MONTEMAR ADVENTIST ELEMENTARY SCHOOL,MAG,,, , ,
01-DK-000094,SAN VICENTE WEST DAY CARE CENTER,MAG,,, , ,
01-DJ-000028,SAN RAFAEL HIGH SCHOOL,MAG,,"Abra de Ilog, Occ. Mindoro", , , 
01-DI-000002,CERCA LA PLAYA LEARNING CENTER,MAG,"Dili,","Gasan, Marinduque", , ,
01-DJ-000006,D-SHEP FOUNDATION ACADEMY,MAG,"Sta. Lucia II,","Sablayan, Occidental Mindoro", , ,
01-DK-000066,ORIENTAL MINDORO ACADEMY (HS),MAG,,"Victoria, Oriental Mindoro", , ,
01-DL-000010,BROOKE'S POINT CHRISTIAN HS,MAG,"Poblacion, Brooke's Point,",Palawan, , ,
01-DK-000067,ORIENTAL MINDORO INSTITUTE,MAG,"Lucio Laurel,","Gloria, Oriental Mindoro", , ,
01-DO-000005,FABELLA INSTITUTE (E/H),MAG,,"San Andres, Romblon", , ,
01-DL-000033,INFANT JESUS LEARNING CENTER,MAG,"159 Rizal Ave.,","Puerto Princesa City, Palawan", , ,
01-DO-000012,ODIONGAN BAPTIST CHURCH SCHOOL,MAG,"022 Gen. Luna St., Brgy Liwayway","Odiongan, Romblon", , ,
01-DJ-000016,MATER DEI LEARNING CENTER,MAG,76 Gozar Buenavista,"Sablayan, Occidental Mindoro", , ,
01-DI-000025,QUEZON-ROXAS HIGH SCHOOL (HS),MAG,"Camarines Dulong Bayan, Poblacion,","Mogpog, Marinduque", , ,
01-DL-000026,GRACE CHRISTIAN SCH.-PALAWAN,MAG,"#7 Wiscom Rd.,","Puerto Princesa City, Palawan", , ,
01-DJ-000012,HOLY FAMILY CHILDREN LEARNING CENTER,MAG,"Holy Family Parish Cmpd., Central,","San Jose, Occidental Mindoro", , ,
01-DO-000008,GOOD SHEPHERD LEARNING CENTER,MAG,"F.Fetalino Poblacion,","Calatrava, Romblon", , ,
01-DI-000030,STA. CRUZ GOSPEL CHURCH LRNG. CTR.(SCGC),MAG,"D. Arco St.,","Sta. Cruz, Marinduque", , ,
01-DJ-000034,SHAMMAH CHRISTIAN LEARNING CENTER,MAG,,, , ,
01-DL-000086,STO. NINO PARISH LRNG. CTR-ESPA�OLA,MAG,"Pulot Center,","Sofronio Espa�ola, Palawan", , ,
01-DJ-000033,WEST MINDORO ACADEMY,MAG,"National Road, Brgy 8","Mamburao, Occidental Mindoro", , , 
01-DJ-000030,STELLA MARIS SCHOOL OF LUBANG,MAG,"Quezon Blvd.,Brgy.Araw Bituin","Lubang, Occidental Mindoro", , ,
01-DL-000015,CHRISTIAN DOORS LEARNING CENTER,MAG,"Purok Lanzones, Brgy Sicsican,","Puerto Princesa City, Palawan", , ,
01-DL-000059,PALAWAN STATE UNIV.-CUYO CAMPUS,MAG,,"Centro, Cuyo, Palawan", , ,
01-DJ-000004,"CORD FOUNDATION, INC.",MAG,"San Roque 2,","San Jose, Occidental Mindoro", , ,
01-DL-000046,LILY OF THE VALLEY LEARNING CENTER,MAG,"Purok Kilos Agad,","San Miguel, Puerto Princesa City", , ,
01-DL-000095,PCGAMI LEARNING CENTER,MAG,,, , ,
01-DL-000085,STO. NINO PARISH LEARNING CENTER,MAG,"Brgy. Princess Urduja,","Narra, Palawan", , ,
01-DL-000069,PULOT ADVENTIST ELEM. SCHOOL,MAG,c/o Central Luzon Conference,"#44 Manalo Ext., Puerto Princesa City", , ,PALAWAN ADVENTIST MISSION
01-DO-000022,ST. ANDREW'S LRNG. & TRAINING,MAG,,"San Andres, Romblon", , , 
01-DO-000021,SIBUYAN CATHOLIC SCHOOL,MAG,"Imm. Conception Shrine Parish,","San Fernando, Romblon", , , 
01-DO-000017,ROMBLON COLLEGE (HS),MAG,,"Odiongan, Romblon", , , 
01-DO-000014,ODIONGAN SDA ELEMENTARY SCHOOL,MAG,,"Odiongan, Romblon", , , 
01-DO-000013,ODIONGAN CHRISTIAN SCHOOL,MAG,"Four Square Church,","Odiongan, Romblon", , , 
01-DO-000002,ALCANTARA NATIONAL TRADE SCHOOL,MAG,,"Alcantara, Romblon", , , 
01-DO-000001,ADVENTIST MISSION ACADEMY,MAG,,"Odiongan, Romblon", , , 
01-DK-000070,PINAMALAYAN ANGLO SCHOOL (E/H),MAG,,"Pinamalayan, Oriental Mindoro", , , 
01-DK-000051,LUNA GOCO COLLEGE (E/HS),MAG,"Calapan City,",Oriental Mindoro, , , 
01-DK-000041,JIL CHRISTIAN SCHOOL-BONGABONG,MAG,"Bagong Bayan I,","Bongabong, Oriental Mindoro", , , 
01-DK-000026,EVANGELISTA NAT'L HIGH SCHOOL,MAG,,"Naujan, Oriental Mindoro", , , 
01-DK-000018,DE LA VIDA LEARNING CENTER,MAG,,"Roxas, Oriental Mindoro", , , 
01-DK-000008,AURORA MEMORIAL HIGH SCHOOL,MAG,Aurora,"Naujan, Oriental Mindoro", , , 
01-DJ-000032,THE UNITED METHODIST CHURCH DEV'T CENTER,MAG,,"Magsaysay, Occidental Mindoro", , , 
01-DJ-000015,MARANATHA CHRISTIAN SCH.-SAN JOSE,MAG,"Labangan, Poblacion,","San Jose, Occidental Mindoro", , , 
01-DI-000033,WEST SIDE MONTESSORI SCHOOL,MAG,,"Sta. Cruz, Marinduque", , , 
01-DI-000032,STO. NINO HIGH SCHOOL,MAG,,"Gasan, Marinduque", , , 
01-DI-000023,ORILLA'S LEARNNING CENTER,MAG,"Brgy. Isok 1,","Boac, Marinduque", , , 
01-DI-000021,MIDWEST HIGH SCHOOL,MAG,"Gasan, Marinduque",, , , 
01-DI-000014,MARINDQUE VICTORIANS ACADEMY,MAG,(Frmly: Buenavista Academy),"Buenavista, Marinduque", , , 
01-DI-000013,MARCOPPER SCHOOL (P/E),MAG,,"Sta. Cruz, Marinduque", , , 
01-DI-000010,LORD OF THE LORD CHRISTIAN SCHOOL,MAG,,"Kawit, Boac, Marinduque", , , 
01-DI-000004,DON LUIS HIDALGO MEMORIAL SCHOOL,MAG,,"Boac, Marinduque", , , 
01-DL-000027,HEAVENS JEWELS LEARNING CENTER,MAG,"Palawan Adventist Hospital Compound,","San Pedro, Puerto Princesa City", , ,
01-DL-000089,WHAT THE BIBLE SAYS X'TIAN ACAD.,MAG,"Bible Bapstist, San Pedro,","Nat'l Hiway, Puerto Princesa City", , ,
01-DB-000169/01-DB-000170,STA. TERESA COLLEGE (E/HS),MEN,"Bauan-Batangas Provincial Rd, Poblacion","Bauan, Batangas", ,LIPA,USAL
01-DC-000002/01-DC-000003,BATANGAS STATE UNIVERSITY (E/HS),MEN,Rizal Avenue Extension,Batangas City, , ,BCPRISA
01-DB-000172,STO. NINO FORMATION & SCI. SCH,MEN,"J. Belen St.,","Rosario, Batangas", , ,PRISAAB
01-DB-000149/01-DB-000150,ST. JAMES ACADEMY (PE/E/HS),MEN,"Poblacion,","Ibaan, Batangas",OSJ,,LIDICSA
01-DG-000020,LIPA CITY COLLEGE (E/HS),MEN,G. A. Solis Street,"Poblacion, Lipa City", , ,APPEAL
01-DC-000005,CASA DEL BAMBINO EMMANUEL MONTESSORI,MEN,"Contreras Compound,", Batangas City, , ,BCPRISA
01-DB-000075/01-DB-000076,JOSEPH MARELLO INSTITUTE (E/HS),MEN,"Burgos St., Poblacion,","San Juan, Batangas",OSJ,,LIDICSA
01-DB-000106,MOTHER BARBARA MICARELLI SCH.,MEN,"San Miguel,","Sto. Tomas, Batangas",FMIJ,,LIDICSA
01-DB-000154,ST. JOSEPH INSTITUTE-ROSARIO,MEN,"Carandang St., ","Rosario, Batangas",OSJ,,LIDICSA
01-DB-000063,HOLY TRINITY SCHOOL,MEN,"M.H. del Pilar St.,","Padre Garcia, Batangas", , ,
01-DG-000003,BATANGAS COLLEGE OF ARTS & SCIENCE,MEN,(Formly: Batangas Science School),"Banay-Banay, Lipa City", , ,PRISAAB
01-DB-000082,LA PURISIMA CONCEPCION ACADEMY,MEN,"Brgy. II,","Mataas ng Kahoy, Batangas", , ,PRISAAB
01-DB-000130/01-DB-000131,SAN GUILLERMO ACADEMY (E/HS),MEN,"Talisay-Laurel Rd., Balas","Talisay, Batangas", ,LIPA,USAL
