01-EC-000021,FELIX ALFELOR FOUNDATION COLL.,BIE,"San Juan Ave.,","Sipocot, Camarines Sur", , ,
01-EC-000030,KOLEHIYO NG MAMAMAYAN (E),BIE,"San Isidro,","Pili, Camarines Sur", , ,
01-EC-000035,LITTLE THINKER'S EDUC. CENTER,BIE,Brgy. San Vicente,"Pili, Camarines Sur", , ,
01-EC-000054,PILI CAPITAL EDUC'L CTR. INC.,BIE,San Isidro,"Pili, Camarines Sur", , ,
01-EC-000059,QUEZON CAMARINES HIGH SCHOOL,BIE,"Poblacion,","Ragay, Camarines Sur", , ,
01-EC-000061,RAGAY SDA MULTIGRADE SCHOOL,BIE,"Lower Sta. Cruz,","Ragay, Camarines Sur", , ,
01-EC-000064,SAN LORENZO RUIZ FORMATION CENTER,BIE,"GRS, Ragay,",Camarines Sur,DM,Caceres,
01-EC-000073,ST. JOSEPH ACAD.-BUHI,BIE,,"Buhi, Camarines Sur", , ,
01-EC-000085,STA. RITA DE CASCIA SCHOOL,BIE,,"Del Gallego, Camarines Sur", ,Libmanan,
01-ED-000001,ASSUMPTA FORMATION CENTER,BIE,,"Virac, Catanduanes", ,Virac,
01-ED-000003,"IMM. CONCEPTION SCH.-CAVINITAN,VIRAC",BIE,"Imm. Conception Parish Church,","Cavinitan, Virac, Catanduanes", , ,
01-ED-000007,ST. JOHN THE BAPTIST CHILD FORMATION CTR,BIE,,"Bato, Catanduanes", ,Virac,
01-ED-000008,STARKIDS KINDERGARTEN SCHOOL,BIE,"116 Constantino,","Virac, Catanduanes", , ,
01-EE-000003,IRIGA SDA MULTIGRADE SCH. (E),BIE,,Iriga City, , ,
01-EE-000015,VERBUM DEI SCHOOL,BIE,"San Roque,",Iriga City, , ,
01-EF-000002,AMEC SCIENCE HIGH SCHOOL,BIE,,Legazpi City, , ,
01-EF-000017,LEGAZPI SDA MULTIGRADE SCH (E),BIE,"Marquez St., cor N. Rivera St.,","Old Albay, Legazpi City", , ,
01-EF-000020,NAZARENE KINDER SCHOOL,BIE,"1009 Rizal St.,","Legazpi City, Albay", , ,
01-EF-000023,SOUTHERN LUZON MISSION,BIE,"Rivera St., cor Marquez St.,","Old Albay, Legazpi City", , ,
01-EH-000010,FIRST UNITED METHODIST CHURCH D.C.C.,BIE,,"157 Bagumbayan Norte, Naga City", , ,
01-EH-000019,MC MARIANO ELEMENTARY SCHOOL,BIE,"Mariano Subd.,","Magsaysay Ave., Naga City", , ,
01-EH-000026,NAGA CITY SEED MONTESSORI SCHOOL,BIE,,"Magnolia St., Naga City", , ,
01-EH-000030,NAGA SDA MULTIGRADE SCHOOL,BIE,"Magsaysay Ave.,",Naga City, , ,
01-EI-000006,ANNUNCIATION COLLEGE-SORSOGON,BIE,"Magsaysay Ave.,",Sorsogon City, , ,
01-EI-000007,BAGONG NILALANG CHILD CARE (BNCC),BIE,,"Almendras, Sorsogon City", , ,
01-EI-000008,BAGONG PAG-AALAGA CHILD CARE,BIE,"Aguinaldo St., Poblacion Norte,","Barcelona, Sorsogon", , ,
01-EI-000010,BULAN MONTESSORI SCHOOL,BIE,"Padre Severino Diaz St.,","Zone 7, Bulan, Sorsogon", , ,
01-EI-000011,CHIANG KAI SHEK SCHOOL OF SORSOGON,BIE,(Frmly: Sorsogon Chinese School),"Magsaysay St., Sorsogon City", , ,
01-EI-000012,COL. DELA IMMACULADA CONC. (H),BIE,,"Bulan, Sorsogon", , ,
01-EI-000014,DR. SUN YAT SEN MEMORIAL SCH.,BIE,"Zone III, Disky St.,","Bulan, Sorsogon", , ,
01-EI-000016,EARLY EDUCATION CENTER,BIE,(near Gubat High School),"Gubat, Sorsogon", , ,
01-EI-000032,NAZARENE KINDERGARTEN SCHOOL,BIE,"cor. P. Diaz & Hilao Sts., Zone 6,","Bulan, Sorsogon", , ,
01-EI-000033,NEO KINDERGARTEN SCHOOL,BIE,,"Kugon, Sorsogon City", , ,
01-EI-000038,PARISH OF IMM. CONCEPCION SCHOOL,BIE,Town Proper,"Bulan, Sorsogon", , ,
01-EI-000039,QUEENSHIP OF MARY LRNG. CTR.,BIE,"Seabreeze Homes, Ph-III, Brgy Cabiaoan","Sorsogon, Sorsogon", , ,
01-DD-000942,ST. EDWARD INTEGRATED SCHOOL-IMUS,BUC,LANCASTER ESTATE ALAPAN 1,"Imus, Cavite", , ,LASSO
01-DP-000020,LICEO DE SAN PABLO,BUC,M. Paulino Street,San Pablo City, ,San Pablo,LICEO
01-DF-000334,MATER ECCLESIAE SCHOOL,BUC,"Villa Olympia Subd.,","San Pedro, Laguna",DVMI,,LACASA
01-DF-000104,COL. DE STA. ROSA DE LIMA,BUC,PHASE 1OLYMPIA PARK SUBD'LABAS,"Sta. Rosa, Laguna", , ,LAPRISADA
01-DF-000447,SOUTH CITY HOMES ACADEMY,BUC,"Tagbilaran St., South City Homes,","Binan, Laguna", , ,LAPRISADA
01-DF-000248,LADY OF ROSE ACADEMY,BUC,"Blk-10 Lot 16, Rosario Village,","Sala, Cabuyao, Laguna", , ,LAPRISADA
01-DD-000815,THE FIRST UNITING CHRISTIAN SCHOOL,BUC,"Blk 52 Lot 2, (R-5) City Homes,","Resort Village, Dasmarinas, Cavite", , ,CAPS
01-DF-000281,LICEO DE SAN PEDRO-LAGUNA,BUC,"Luna St.,","San Pedro, Laguna", ,San Pablo,LICEO
01-DD-000576,OUR LADY OF REMEDIOS MONTESSORI SCH.,BUC,"Sunshine Country, Brgy. Buenavista II,","General Trias, Cavite", , ,CAPS
01-DF-000090/01-DF-000091,CHRISTIAN INTERNATIONAL SCH.-E/HS,BUC,"Kanluran, UP College","Los Banos, Laguna", , ,LAPRISADA
01-DF-000277,LICEO DE PAKIL,BUC,ESTACA BURGOS ST,"Pakil, Laguna",,San Pablo,LICEO
01-DF-000265/01-DF-000266,LICEO DE CALAMBA (E/HS)-MAIN,BUC,Burgos Street,"Calamba, Laguna", ,San Pablo,LICEO
01-DD-000361,INFANT JESUS MONT.-SAN MARINO,BUC,"Central, San Marino City Subd.,","Salawag, Dasmarinas, Cavite", , ,CAPS
01-DF-000262,LICEO DE CABUYAO,BUC,A. Mabini Street,"Cabuyao, Laguna", ,San Pablo,LICEO
01-DF-000430,SAN LORENZO SCHOOL OF SAN PEDRO,BUC,"608 Mayumi St., United San Pedro Subd.,","San Pedro, Laguna", , ,LAPRISADA
01-DF-000193,HOLY REDEEMER SCHOOL,BUC,BGY BANLIC,"Cabuyao, Laguna", , ,LAPRISADA
01-DD-000052,ATHENEUM SCHOOL,BUC,"Sea View Subd., San Rafael II","Noveleta, Cavite", , ,CAPS
01-NH-000069,OUR LADY OF THE ABANDONED CATH. SCH.,BUC,"J.P. Rizal St.,","Poblacion, Muntinlupa City", ,PARA�AQUE,MAPSA
01-DF-000472,ST. GABRIEL ARCHANGEL ACADEMY,BUC,"B-22 L-15 Minosota St., South-","ville Subd., Binan, Laguna", , ,
01-DD-000161,CHRISTAR ACADEMY,BUC,"B-34 L-22 RV 2, City Homes,","Resortville, Dasmarinas, Cavite", , ,CAPS
01-DF-000282,LICEO DE VICTORIA,BUC,J. P. Rizal Street,"Victoria, Laguna", ,San Pablo,LICEO
01-DD-000765,ST. NICHOLAS DE MYRA SCHOOL,BUC,"Congressional East Ave.,","Burol, Dasmarinas, Cavite", , ,CAPS
01-NH-000048,MA. FERRARI SCHOOL,BUC,"409 Hersey St., Summit Home,","Bayanan, Muntinlupa City", , ,
01-DD-000211,DEI GRACIA ACADEMY-T.M.C,BUC,"La Trinidad Subd., Cabuco,","Trece Martirez City, Cavite", , ,CAPS
01-NH-000104,STO. NINO SCHOOL - MUNTINLUPA,BUC,"St. Anthony St., Sto. Nino Village","Poblacion, Muntinlupa City", , ,MUNTINLUPA PRIV SCHOOL
01-DD-000856,"VOX DEI PLAY & LEARN CENTER, INC-IMUS",BUC,"B-22 L-11 Ph-2, ACM Woodstock Homes,","Alapan I-A, Imus, Cavite", , ,
01-DF-000270/01-DF-000271,LICEO DE LOS BANOS (E/HS),BUC,M.Palis,"Los Banos, Laguna", ,San Pablo,LICEO
01-DF-000515,STA. MARIA ACADEMY,BUC,Poblacion Brgy.2,"Sta. Maria, Laguna", , ,LAPRISADA
01-DF-000278/01-DF-000279,LICEO DE PILA (E/HS),BUC,St. Anthony of Padua Parish,"Rivera St., Pila, Laguna", ,San Pablo,LICEO
01-NH-000050,MARY CAUSE OF OUR JOY CATH.SCH,BUC,Soldiers Hills Village,Muntinlupa City, , ,
01-DD-000426,LA CAMELLE SCHOOL,BUC,"Pieces St., Ph-II C,","Camella Homes Subd.,Bacoor, Cavite", , ,CAPS
01-DD-000235,DUNNHILL ACADEMY,BUC,"Salawag,","Dasmarinas, Cavite", , ,
01-DD-000579,OXFORD LOUIS ACADEMY,BUC,"B-7 L-3 Saipan St., Emerald Crest Subd.","San Agustin, Dasmarinas, Cavite", , ,CAPS
01-DD-000524,METANOIAH ACADEMY,BUC,"Blk 102 L-31-40, Ph-IV, Mabuhay City,","Paliparan, Dasmarinas, Cavite", , ,
01-DD-000051,ASIAN TRINITY SCHOOL,BUC,"Dasma Gardenville, Congress'l East","Ave., Dasmarinas, Cavite", , ,CAPS
01-DF-000388,PANORAMA MONT. SCHOOL - BINAN,BUC,"Hiway - Canlalay,","Binan, Laguna", , ,LAPRISADA
01-DD-000586,PATNUBAY ACADEMY,BUC,(Formerly Patnubay Kiddie L.C.),"037 San Juan, Noveleta, Cavite", , ,CAPS
01-DD-000270,GAZELLAN COLLEGE,BUC,(Magallanes Kiddie L.C.) Pob. IV,"#90 M. de Guia St. Magallanes, Cavite", , ,
01-DF-000095,CHRISTIAN SCIENCE ACADEMY,BUC,"Series II, Waling-Waling","Canlubang, Laguna", , ,
01-NH-000062,MUNTINLUPA INST.OF TECHNOLOGY,BUC,"National Road,","Poblacion, Muntinlupa City", , ,MUNTINLUPA PRIV SCHOOL
01-DF-000389,PANORAMA MONT. SCHOOL-STA.ROSA,BUC,PANORAMA VILLAGE BGY DITA,"Sta. Rosa, Laguna", , ,LAPRISADA
01-DD-000883,INFANT JESUS MONT.-SILANG,BUC,"Bry. Puting Kahoy, Sta. Rosa Heights,","Silang, Cavite", , ,CAPS
01-DD-000033,AMORE ACADEMY,BUC,"Brgy. Luciano,","Trece Martirez City, Cavite", , ,CAPS
01-DD-000358,INDANG CHRISTIAN ACADEMY,BUC, Alulod St,"Indang, Cavite", , ,
01-DF-000465,ST. CLAIRE SCHOOL - CABUYAO,BUC,"Ph. I B-2 L-18, Lakeside,","Banay-Banay, Laguna", , ,
01-DF-000263/01-DF-000264,IMMACULATE CONCEPCION CATH. (E/HS)-CALAMBA,BUC,BGY MAKILING ANNEX,"Calamba City, Laguna", ,San Pablo,LICEO
01-DD-000920,BEULAH LAND INTEGRATED SCIENCE SCHOOL,BUC,"Fairway View,","Dasmarinas, Cavite", , ,CAPS
01-DF-000062,CAPITOL VIEW CHRISTIAN SCHOOL,BUC,"P GUEVARRA ST,INFRONT LAGUNA CAPITOL","Sta. Cruz, Laguna", , ,
01-DF-000233,JOSEPH & MARY ACADEMY,BUC,"Rainbow Ave., Pacita Complex II,","San Pedro, Laguna", , ,LAPRISADA
01-DF-000055,CANLUBANG CHRISTIAN SCHOOL,BUC,"227 Sabio St., Mayapa","Canlubang, Laguna", , ,LAPRISADA
01-DF-000495,ST. PETER & PAUL EARLY CHILD CENTER,BUC,"B-10 L-88-89, Ph.III,","Golden City, Sta. Rosa, Laguna", , ,
01-DD-000609,PRINCE ARIES CHRISTIAN SCHOOL,BUC,"B-3 L-3 Goldenville II,","Sabang, Dasmarinas, Cavite", , ,
01-DF-000275,LICEO DE PAETE,BUC,PUROK 9,"Paete, Laguna", ,San Pablo,LICEO
01-NH-000032,INFANT JESUS MONT.-MUNTINLUPA,BUC,"357 MIDLAND ALLEY ST,","Tunasan, Muntinlupa City", , ,MUNTINLUPA PRIV SCHOOL
01-DF-000026,ARISE AND SHINE ACADEMY,BUC,"12 J.P. Rizal Ave.,","Cabuyao, Laguna", , ,LAPRISADA
01-DD-000905,"DRUMMOND LIGHT ACADEMY, INC.",BUC,,, , ,
01-DF-000276,LICEO DE PAGSANJAN,BUC,"Gen.Taino St.,","Pagsanjan, Laguna", ,San Pablo,LICEO
01-DD-000283,GOD THE ALMIGHTY ACADEMY,BUC,"B-10 L-10 Winward Hills,","DBB Area B, Dasmarinas, Cavite", , ,CAPS
01-DD-000209,DE ROMAN MONTESSORI SCHOOL,BUC,119 ROSAL ST AMAYA 1,"Tanza, Cavite", , ,CAPS
01-DF-000205,INFANT JESUS MONT. CENTER-BINAN,BUC,"Blk.2-A L-2-A Ph. 3-D, Archery St.,","Macaria Village, Binan, Laguna", , ,LAPRISADA
01-DF-000267,LICEO DE CALAUAN,BUC,"Brgy.Silangan,","Calauan, Laguna", ,San Pablo,LICEO
01-NH-000047,LIVING LIGHT ACADEMY-MUNTINLUPA,BUC,VILLA EMILLA SUBD,"Putatan, Muntinlupa City", , ,MUNTINLUPA PRIV SCHOOL
01-DD-000853,VILLAGGIO IGNATIUS IN'L. SCHOOL,BUC,Villaggio Ignatius,"Buenavista I, Gen. Trias, Cavite", , ,CAPS
01-DF-000584,LITTLE ANGELS CHRISTIAN SCHOOL-PAGSANJAN,BUC,Frmly:LITTLE ANGELS CHRISTIAN SCHOOL,"J.P. Rizal St.,Pagsanjan, Laguna", , ,LAPRISADA
01-DF-000296,LITTLE PEOPLE SCHOOL,BUC,BGY SAN ISIDRO,"Bay, Laguna", , ,LAPRISADA
01-DD-000231,COLEGIO DE FRANCESCA (FRMLY:DOR'S),BUC,(Dor's X'tian School)Sunny Brooke II,"San Francisco, Gen. Trias, Cavite", , ,CAPS
01-DF-000009,AGNUS DEI SCHOOL SYSTEM INC.,BUC,"167 Fiesta Blvd.,","Holinday Hill Vill., San Pedro, Laguna", , ,LAPRISADA
01-DF-000169,GREATLAND KINDER & GRADE SCH.,BUC,"Aurora Heights Subd.,","San Pedro, Laguna", , ,LAPRISADA
01-DF-000525,SUNNY VILLE SCHOOL,BUC,"Frmly:Kids Ville Sch.-B-127 L-1&2 Ph.2,","Mabuhay City, Mamatid, Cabuyao, Laguna", , ,CAPS
01-DD-000813,THE BLESSING IN THE WORD SCHOOL,BUC,"155  J.P. Rizal Ave.,","Kaybagal South, Tagaytay City, Cavite", , ,CAPS
01-DF-000261,LICEO DE BAY,BUC,"0 Rizal Ave., Brgy. San Agustin","Bay, Laguna", ,San Pablo,LICEO
01-DD-000146,CHILD OF ZION ACADEMY,BUC,"Tatic Homes, Zone II,","Bulihan, Silang, Cavite", , ,CAPS
01-DF-000399,PRINCETON ACADEMY,BUC,"Ph.5 Blk. 99 L-384,","Laguna Bel-Air, Sta. Rosa, Laguna", , ,LAPRISADA
01-NH-000015,CHRISTIAN LOVE SCHOOL,BUC,"J.P. Rizal Street,","Poblacion, Muntinlupa City", , ,
01-DF-000575,TWIN STARS SCHOOL OF CALAMBA CITY,BUC,,, , ,
01-DF-000202/01-DF-000203,IMM. CONCEPCION SCHOOL-DON BOSCO (E/HS),BUC,"Valenzuela St.,","Sta. Cruz, Laguna", ,San Pablo,LICEO
01-DF-000464,ST. CHARLES AGUSTINE SCHOOL,BUC,(Formerly Little Wonders Lrng. Ctr.),"Brgy. Timbao, Binan, Laguna", , ,LAPRISADA
01-DD-000203,DANSART ANGEL LEARNING SCHOOL,BUC,"B-24 L-13-14, Summerwind IV,","Dasmarinas, Cavite", , ,CAPS
01-DD-000795,STO. NINO DE LEBELLE ACADEMY,BUC,"St. Anthony St., Belvedere Town's","Paradahan, Tanza, Cavite", , ,CAPS
01-DF-000207,INFANT JESUS MONT.-SAN PEDRO,BUC,"Woodhills, Camella Homes,,","San Pedro, Laguna", , ,LAPRISADA
01-DF-000269,LICEO DE LILIW,BUC,"GAT TAYAW ST,","Liliw, Laguna", ,San Pablo,LICEO
01-DD-000514,MARY MEDIATRIX OF ALL GRACE SCH.,BUC,"Pius St., Windward Hills Subd.,","DBB II, Dasmarinas, Cavite", , ,CAPS
01-DF-000538,TRACE COLLEGE,BUC,"El Danda St.,","Brgy. Batong Malake, Los Banos, Laguna", , ,LAPRISADA
01-DD-000487,LYCEUM OF CAVITE EAST (RAISING KIDS),BUC,"(Raising Kids CDC) PhII, Regina Vill'02","Brgy. Inocensio, Trece Martirez City", , ,CAPS
01-DF-000273,LICEO DE MAJAYJAY,BUC,"Plaza Rizal St.,","Majayjay, Laguna", ,San Pablo,LICEO
01-DD-000166,CHRISTIAN JOAN SCHOOL,BUC,Malagasang II-G,"Imus, Cavite", , ,CAPS
01-DD-000835,TRIUMPHANT CHRISTIAN SCHOOL,BUC,"565 Gen. Bautista St.,","Imus, Cavite", , ,CAPS
01-DF-000358,NAGCARLAN MONTESSORI SCHOOL,BUC,"Rizal Ave.,","Nagcarlan, Laguna", , ,LAPRISADA
01-DF-000274,LICEO DE MAMATID (HS),BUC,"Mamatid,","Cabuyao, Laguna", ,San Pablo,LICEO
01-DF-000521,LOS BANOS DAY CARE CENTER,BUC,,, , ,DSWD
01-DD-000060,BAKERSFIELD LEARNING CENTER,BUC,"B-1 L-4 Sunnydale Villas,","Malagasang I-B, Imus, Cavite", , ,
01-DF-000439,SHEPHERD FLOCK SCH. OF CABUYAO,BUC,DME COMPOUND BGY PULO,"Pulo, Cabuyao, Laguna", , ,LAPRISADA
01-DF-000434,ST. JOSEPH SCHOOL OF CABUYAO,BUC,(Frmly: St. Joseph School),"Ph. I,St. Joseph Vill, Cabuyao, Laguna", , ,LAPRISADA
01-DD-000219,DISCIPLES LEARNING ACADEMY,BUC,410 bgy SABANG,"Dasmarinas, Cavite", , ,CAPS
01-DF-000409,REAL CHRISTIAN SCHOOL (DOOR OF FAITH),BUC,(Formerly Door of Faith X'tian Sch.),"Brgy. Real, Calamba City, Laguna", , ,LAPRISADA
01-DF-000602,"WELLSPRING ACADEMY OF CANLUBANG, INC",BUC,"B-42 L-12&14 Palao 2, Kapayapaan Vill.,","Canlubang, Calamba City, Laguna",,,LAPRISADA
01-DD-000601,PLAINVIEW ACADEMY,BUC,"Congressional Rd., Dasma.,","Bagong Bayan, F2, Dasma., Cavite", , ,
01-DD-000229,DORCAS KINDERGARTEN SCHOOL,BUC,# 5 dela Pena St,"Amadeo, Cavite", , ,CAPS
01-DD-000910,PTM JESUS IS LOVE ACADEMY,BUC,"Asia Pacific Mission Center-NIA Rd.,","Paliparan I, Dasmarinas, Cavite", , ,CAPS
01-DD-000171,CHRISTIAN VISION SCH. OF DASMA.,BUC,"39 Don Placido Campus St.,","Dasmarinas, Cavite", , ,CAPS
01-DD-000866,WISDOM WORLD ACADEMY,BUC,"0191 Celestino St., New Niog Village,","Niog, Bacoor, Cavite", , ,
01-DF-000043,BLESSED JAMES CUSMANO ACADEMY,BUC,Brgy. San Antonio,"Mabitac, Laguna", , ,LAPRISADA
01-DF-000597,JUBILATION INTERNATIONAL MONTESSORI CTR.,BUC,"Ph.II Evergreen Country,","Jubilation Subd., Binan City, Laguna",,,LAPRISADA
01-DF-000240,KIDDIE INTEGRATED DEV'T SCH.,BUC,"361 Chipeco Ave., Lucheria,","Calamba City, Laguna", , ,LAPRISADA
01-DD-000901,MEMORARE ACADEME OF CAVITE,BUC,,, , ,CAPS
01-DF-000331,MARY'S CHILD LRNG. CTR.-BINAN,BUC,"San Francisco Home,","Binan, Laguna", , ,LAPRISADA
01-DF-000189,HOLY FAMILY OF NAZARETH SCH.-BAY,BUC,"Y. Calces St.,","San Nicholas, Bay, Laguna", , ,LAPRISADA
01-NH-000013,CHRIST THE KING SCHOOL,BUC,"Jaysonville II,","Putatan, Muntinlupa City", , ,MUNTINLUPA PRIV SCHOOL
01-DF-000489,ST. MARY'S ACADEMY-NAGCARLAN,BUC,(Formerly Sacred Heart Academy),"Nagcarlan, Laguna",RVM,,
01-DF-000609,ST. CLAIR OF ASSISI LEARNING CENTER,BUC,Brgy.Gulod,"Brgy. Gulod, Cabuyao, Laguna",,,
01-NH-000078,SACRED HEART INSTITUTE,BUC,"Katihan St., Poblacion,",Muntinlupa City, , ,MUNTINLUPA PRIV SCHOOL
01-DD-000165,CHRISTIAN HOOD LEARNING CENTER,BUC,"Tirona Rd., San Agustin II,","Dasmarinas, Cavite", , ,CAPS
01-DD-000911,"STA. LUCIA SCHOOL OF LIGHT, INC.",BUC,"B15 L-15 Malvar St., Ciudad Adelina,","Brgy. Conchu, Trece Martirez City,Cavite", , ,
01-DD-000463,LITTLE MINES DEVELOPMENT CENTER,BUC,"Belveder Subd.,","Paradahan I, Tanza, Cavite", , ,
01-DD-000928,STATEVILLE ACADEMY,BUC,"Greenmark Homes, Malagasang II,","Imus, Cavite", , ,CAPS
01-DD-000918,ROYAL PALM ACADEMY OF CAVITE,BUC,BGY CALUMPANG LEJOS,"Indang, Cavite", , ,CAPS
01-DD-000893,INSTITUTO MARIA IMMACOLATA,BUC,"214 Banay-banay,","Amadeo, Cavite", , ,
01-DF-000608,CAMELEAN ACADEMY,BUC,157 Do�a Camela Acero Bldg.,"Brgy. Buhay Siniloan, Laguna",,,
01-DF-000190,HOLY FAMILY OF NAZARETH SCH.-BINAN,BUC,"St. Rose Village II, Brgy. Casile","Binan, Laguna", , ,
01-DF-000268,LICEO DE CAVINTE,BUC,"Poblacion,","Cavinte, Laguna", ,San Pablo,LICEO
01-DD-000667,SEED OF WISDOM LEARNING CENTER,BUC,"Blk 6 Lot 1, Camella Homes","Mabolo III, Bacoor, Cavite", , ,
01-DD-000887,KERUSSO CHRISTIAN ACADEMY,BUC,"COG Bldg., Emilio Aguinaldo Highway,","Marilag Subd., Dasmarinas, Cavite", , ,
01-DD-000191,CORINTHIAN SCHOOL OF CAVITE,BUC,"Gov. Ferrer Ave., cor D. Mojica St.,","Gen. Trias, Cavite", , ,CAPS
01-DD-000831,TORCH OF WISDOM MONT.-DASMA.,BUC,"Area C-5 lot 4, Brgy. San Simon,","Bagong Bayan Dasmarinas, Cavite",,,
01-DF-000272,LICEO DE LUISIANA (HS),BUC,"Bonifacio st.,","Luisiana, Laguna", ,San Pablo,LICEO
01-DF-000398,PRINCE & PRINCESS PRE-SCHOOL,BUC,"B-19 L-4, South City Homes,","Sto. Tomas, Binan, Laguna", , ,LAPRISADA
01-DD-000241,EMMAUS LEARNING CENTER-BACOOR,BUC,63 Duhat Rd. Justinville Subd.,"Molino,Bacoor, Cavite", , ,
01-DD-000867,WIZBEE INTERNATIONAL SCHOOL,BUC,Km-30 Aguinaldo Highway,"Brgy. Zone I-A,Dasmarinas, Cavite",,,
01-NH-000063,MUNTINLUPA SCH. FOR CHILD DEV'T,BUC,"6 Hyatt St., Pleasantville,","Bayanan, Muntinlupa City", , ,MUNTINLUPA PRIV SCHOOL
01-DF-000049,CABUYAO NURSERY SCHOOL & CHILD CTR.,BUC,BGY BIGAA,"Cabuyao, Laguna", , ,LAPRISADA
01-NH-000054,MBC SINAI SCHOOL,BUC,"#35 Summit Circle,","Bayanan, Alabang, Muntinlupa City", , ,CAPS
01-DD-000496,"MADRE GUIDITTA MARTELLI SCHOOL, INC.",BUC,Km. 15 Lalaan II,"Silang, Cavite", , ,CAPS
01-DF-000581,CHANTAL ACADEMY OF SAN PEDRO,BUC,"Villa Castillo, Pacita II,","San Pedro, Laguna", , ,LAPRISADA
01-DD-000158,CHRIST LIFE LEARNING CENTER-MOLINO,BUC,"B-5 L-31,Purple St.,Camella North","Springville I,Molino,Bacoor,Cavite",,,
01-DF-000557,WORDS OF HOPE WORKSHOP & TUTORIAL CENTER,BUC,"B-14 L-11 Golden City Subd.,","Canlalay, Binan, Laguna", , ,LAPRISADA
01-DD-000573,"OUR LADY OF LORE SCHOOL, INC.",BUC,"B-10 L-19, Ph.-7, ACM Subd.,","Alapan I-A, Imus, Cavite", ,,
01-DD-000950,SEOGWANG CHRISTIAN SCHOOL,BUC,"Lorenzo Sico St.,","Burol Main, Dasmarinas, Cavite",,,
01-DF-000423,SAN ANTONIO ABAD SCHOOL,BUC,"#9 Paterno St.,","Paete, Laguna", , ,LAPRISADA
01-DF-000461,ST. BENEDICK SCHOOL OF CABUYAO,BUC,"P. Burgos,","Cabuyao, Laguna", , , 
01-DF-000322,MARIAN SCHOOL OF CABUYAO,BUC,Brgy. Marinig,"Cabuyao, Laguna", , ,LAPRISADA
01-DF-000576,CROWNWELL INTERNATIONAL SCHOOL,BUC,,, , ,
01-DD-000880,GOD'S GIFT SPED LEARNING CENTER,BUC,"B-13 L-13 Kingfisher St.,Capitol Hills.,","Brgy. Lapidario, Trece Martirez City", , ,CAPS
01-DF-000556,WORD INCARNATE SCHOOL,BUC,"St. Francis 10 Subd.,","San Antonio, Binan, Laguna", , ,LAPRISADA
01-DF-000571,GS LEARNING CENTER,BUC,,, , ,LAPRISADA
01-DD-000946,"PRIME TIME LEARNING CIRCLE, INC.",BUC,"B-34 L-7G Parklane, FElizAna Estate Subd","Pasong Buaya, Imus, Cavite",,,
01-DF-000302,LIVING WATER CHILDREN INSTITUTE,BUC,"Villanueva Subd.,","Brgy. Lingga, Calamba City,Laguna", , ,
01-DD-000550,NAZARENE CHRISTIAN SCHOOL-INDANG,BUC,"Cocoville Subd., Calumpang Cerca,","Indang, Cavite",,,
01-DF-000245,KINDERTECH OF UNO CEVITA,BUC,"Kindertech Bldg., Nat'l Hiway,","Sta. Rosa, Laguna", , ,LAPRISADA
01-DF-000613,CAMBRIDGE SCHOOL INC.,BUC,"Milflores St., Springhomes Subd.,","Calamba City, Laguna",,,
01-DD-000071,BETHANY BIBLE BAPTIST ACADEMY - IMUS,BUC,"4133 Servida Bldg.,","Anabu I-F, Imus, Cavite", , ,
01-DF-000561,MATER ECCLESIAE SCHOOL-VICTORIA,BUC,,,DVMI, ,
01-DF-000179,HEADSTARTER WORKSHOP-BINAN,BUC,"(Frmly:Headstart L.C.) Celica St.,","Mercedes Home,Sto.Thomas, Binan, Laguna", , ,LAPRISADA
01-DF-000564,OUR LADY OF LOS ANGELES SCHOOL,BUC,"Barangay 4,","Sta. Maria, Laguna", , ,LAPRISADA
01-DD-000925,BLESSED GREEN FIELD ACADEMY,BUC,,, , ,CAPS
01-DD-000947,SAN ISIDRO MONTESSORI SCHOOL,BUC,,,,,CAPS
01-DF-000280,LICEO DE SAN ANTONIO (HS),BUC,"O.M. Dela Fuente, San Antonio,Kalayaan","San Antonio, Laguna", ,San Pablo,LICEO
01-DD-000460,LITTLE KIDDIE OF ISAAC CHILD DEV'T CTR,BUC,"LITTLE KIDS OF ISAAC- P. Reyes St.,","Malagasang I, Imus, Cavite", , ,CAPS
01-DD-000692,SPRING OF WISDOM EDUCATION CENTER,BUC,"B-18 L-17 ACM Homes,","Sanja Mayor, Tanza, Cavite", , ,
01-DF-000356,MT. RUSH MORE CHILD CENTER,BUC,"3rd St., Hiway Homes,","Platero, Binan, Laguna", , ,LAPRISADA
01-DD-000953,GATE WAY INTEGRATED SCH. OF SCI. TECH.,BUC,"Tinungan, Mangahan,","General Trias, Cavite",,,
01-DF-000589,A-Z TUTORIAL CENTER,BUC,,, , ,
01-DF-000594,SAN NICOLA DE BARI MONTESSORI,BUC,"Washington Ave., Town&Country","Southville, Binan, Laguna", , ,LAPRISADA
01-DF-000560,YOUR DEVELOPING CHILD ACTIVITY CENTER,BUC,CYPRES ST LAGUNA BELAIR,"Bel-Air, Sta. Rosa, Laguna", , ,LAPRISADA
01-NH-000009,CATHERINE MC-AULEY LEARNING CTR.,BUC,"South Greenheights Subd.,","Pututan, Muntinlupa City",RSM, ,
01-DF-000588,OUR LADY OF MIRACULOUS MEDAL LRNG. CTR.,BUC,,, , ,CAPS
01-DF-000596,TERESA LEARNING CENTER,BUC,"B-8 Lot 15 Sun St.,","Binan, Laguna",,,
01-DF-000605,MABUHAY PHASE LEARNING INSTITUTE,BUC,,,,,
01-DD-000062,BEA THERESE SCHOOL,BUC,"B-13 L-38, Belveder Subd.,","Tanza, Cavite", , ,
01-DD-000169,CHRISTIAN LRNG. CTR.-TRECE MARTIREZ,BUC,"Bgy. Hugo,","Perez II, Trece Martirez City, Cavite", , ,
01-DD-000186,COL. DE SAN JOSE,BUC,"Magallanes Street.,","Carmona, Cavite", , ,
01-DD-000230,DOROTHY JAMES LEARNING CENTER,BUC,,"Biga I, Silang Cavite", , ,
01-DD-000394,JOHN MERCED ACADEMY,BUC,"B-22, Regina Vill.2000,Brgy.Inocencio,","Trece Martirez City, Cavite", , ,
01-DD-000474,LOIS FAITH CHRISTIAN ACADEMY,BUC,,"Mangahan, Gen. Trias, Cavite", , ,
01-DD-000526,MICHAEL ANDREW LEARNING CENTER,BUC,"B-1 L-1, Imperial Homes,","Brgy. Tartaria, Silang, Cavite", , ,
01-DD-000789,STACEY LEARNING CENTER,BUC,"Fiesta Homes,","San Jose, Dasmarinas, Cavite", , ,
01-DD-000859,WEST PLAIN ACADEMY,BUC,"West Plain Subd., San Agustin","Trece Martirez City, Cavite", , ,
01-DF-000096,CHRYS VILLE LEARNING CENTER,BUC,"Chrysanthemum Village,","San Pedro, Laguna", , ,
01-DF-000332,MARY'S CHILD SCHOOL OF CABUYAO,BUC,"Katapatan Village,","Banay, Cabuyao, Laguna", , ,
01-DF-000340,MIRRIAMVILLE SCHOOL,BUC,"B-25 L-10 Phase III, Golden City","Sta. Rosa, Laguna", , ,
01-DF-000351,MOTHER AND TEACHER LEARNING SCHOOL,BUC,"B-3 L-17-19 J.M.L. III Subd., Tulay","Bato,San Antonio, Binan, Laguna", , ,
01-DF-000401,QUEEN ANNE LEARNING SCHOOL,BUC,"Yakal St., Mariquita Pueblo II","Dita, Sta. Rosa, Laguna", , ,
01-DF-000415,RIDPAHT ACADEMY OF MABUHAY CITY,BUC,"Blk 161, Ph. II, Mabuhay City,","Cabuyao, Laguna", , ,
01-DF-000531,TIMOTHY JOHN LEARNING SCHOOL,BUC,"Lawaan St., MCDC Kapayapaan Village,","Canlubang, Calamba Laguna", , ,
01-NH-000060,MULTIPLE INTELLIGENCE MONT.SCH.(M.I.),BUC,"B-25 L-28, Soldier Hills Village,","Putatan, Muntinlupa City", , ,
01-OC-000033/01-OC-000034,ST. LOUIS UNIV. BOY'S HIGH SCHOOL/LAB SCHOOL,DEL,"Bonifacio-General Luna Rd.,",Baguio City,CICM,,
01-NG-000049,MARIST SCHOOL (E/HS),DEL,"50 Champagnat Avenue, Marikina Heights",Marikina City, , , 
01-EE-000013/01-EE-000020,UNIV. OF ST. ANTHONY,DEL,"Dr.ortega St.,San Miguel,",Iriga City, ,,
01-OC-000054/01-OC-000032,ST. LOUIS GIRL'S HIGH SCHOOL-NAGUILIAN (E/HS),DEL,"(Frmly:ST. LOUIS GIRL'S HIGH SCHOOL) Campo Filipino,","Campo Fil.,Naguilian Rd., Baguio City",ICM,,
01-NF-000080/01-NF-000081,ESPIRITU SANTO PAROCHIAL SCHOOL-E/HS,DEL,1912 Rizal Avenue,"Sta. Cruz, Manila",OP DOMINICAN,,
01-NF-000106,HOLY CHILD CATHOLIC SCHOOL,DEL,"Plaza A. Hernandez St.,","Tondo, Manila", ,Manila,MAPSA
01-EF-000024/01-EF-000025,ST. AGNES ACADEMY (E/HS),DEL,"4500 Rizal St.,","Legazpi City, Albay",,Legazpi,
01-NF-000068,DOMINICAN SCHOOL OF MANILA,DEL,"#1044 A.H. Lacson St.,","Sampaloc, Manila",OP DOMINICAN,,
01-NG-000043/01-NG-000044,MARIKINA CATHOLIC SCHOOL (E/HS),DEL,"J.P. Rizal St., San Roque,","Sta. Elena, Marikina City", ,ANTIPOLO,MAPSA
01-ND-000020/01-ND-000021,DE LA SALLE ARANETA UNIVERSITY (E/HS),DEL,(Formerly G. Araneta Univ.Fdt),"Victoneta Ave.,Potrero,Malabon, Metro Manila", ,,
01-OC-000064/01-OC-000075/01-OC-000076,UNIV. OF BAGUIO (E/HS),DEL,General Luna St.,"Gen. Luna, Baguio City", , ,
01-EH-000039,UNIVERSIDAD DE STA. ISABEL (E/HS),DEL,"Elias Angeles St.,",Naga City,DC,,Caceres
01-NF-000288,ST. ANTHONY SCHOOL-SINGALONG,DEL,"2126 Singalong corner San Andres Sts.,","Singalong, Manila", ,Manila,MAPSA
01-EH-000037/01-EH-000038,UNIV. OF NUEVA CACERES (E/HS),DEL,"Jaime Hernandez St.,P.Burgos St.,",Naga City,,,
01-EH-000004,ATENEO DE NAGA UNIVERSITY,DEL,"John Phelan Drive, Km. 7, Pacol", Naga City,SJ,CEACAL,BACS
01-EH-000029,NAGA PAROCHIAL SCHOOL,DEL,"cor Ateneo Ave., Bagumbayan Sur,",Naga City, ,CEACAL,Caceres
01-DN-000295,ROOSEVELT COLLEGE (E/H)-RODRIGUEZ,DEL,"J.P.Rizal St.,Balite","Rodriguez (Montalban), Rizal", , ,
01-OC-000004/01-OC-000005,UNIV. OF THE CORDILLERA'S (E/HS),DEL,"(Frmly:Baguio College Foundation) Hamada Road,","Hamada Rd., Baguio City", , ,
01-NO-000006/01-NO-000007,DOMINICAN SCHOOL OF SAN JUAN-E/H,DEL,"179 F. Blumetritt St.,Tibagan","San Juan, Metro Manila",OP DOMINICAN,,
01-NQ-000099,"ST. CATHERINE SCHOOL, INC.",DEL,"202 Mapulang-Lupa,",Valenzuela City, ,,
01-OC-000006/01-OC-000007,BAGUIO PATRIOTIC SCHOOL (E/HS),DEL,21 Harrison Road,Baguio City, , ,
01-NN-000314,IMM. HEART OF MARY COLLEGE,DEL,"#54 Aurora Blvd.,",Quezon City,DC, ,
01-NF-000122/01-NF-000123,IMM. CONCEPCION ACAD.-MANILA (E/HS),DEL,"2212 Santisimo del Rosario St.,","Gagalangin, Tondo, Manila",MIC,,
01-EF-000007/01-EF-000008,DIVINE WORD COLL. OF LEGAZPI-E/H,DEL,"Washington Drive,","Legazpi City,Albay",SVD,Legazpi,BACS
01-EB-000022,MABINI COLLEGE,DEL,"Gov. Panedes Ave.,","Daet, Camarines Norte", ,,BPSA
01-EB-000030,ST. FRANCIS PAROCHIAL SCHOOL,DEL,"Contreras St.,Talisay","Talisay, Camarines Norte", , ,
01-OC-000020,EASTER COLLEGE INC.,DEL,"Easter Road,","Guisad, Baguio City", , ,
01-NF-000298/01-NF-000299,ST. JOSEPH SCH.-PANDACAN-E/HS,DEL,"Jesus St.,","Pandacan, Manila",,Manila,MAPSA
01-NA-000228/01-ND-000086,SALVADOR ARANETA MEMORIAL INST,DEL,"#12 Reparo St.,","Potrero, Malabon, Metro Manila",,,
01-OC-000014,BERKELEY SCHOOL,DEL,"#30 C.M. Recto St.,","Navy Base Rd., Baguio City", , ,
01-EC-000003,BICOL CENTRAL ACADEMY,DEL,Libod 1,"Libmanan, Camarines Sur",CANAPS, ,
01-EH-000024,NAGA CITY MONTESSORI SCHOOL,DEL,"Mayon Ave. cor Bonifacio drive,","Naga City,Camarines Sur", , ,
01-NF-000233/01-NF-000234,PCU-UNION HIGH SCHOOL (E/HS),DEL,"751 Malvar St.,","Malvar St., Malate,  Manila", , ,
01-OC-000039,OUR LADY OF MT. CARMEL MONTESSORI,DEL,"#16 Camdas Subd.,",Baguio City,,,
