01-OD-000006/01-OD-000007,CORDILLERA CAREER DEV'T COLL. (E/HS),NL,AGC,"W, Buyagan, Poblacion,","La Trinidad, Benguet", , ,
01-OD-000034,PHILEX MINES ELEMENTARY SCHOOL,NL,AGC,"Pacdal,","Tuba, Benguet", ,BAGUIO,
01-OA-000015/01-OA-000016,DIVINE WORD COLL. OF BANGUED-E/H,NL,AGC,"Centro Zone 6,","Bangued, Abra",SVD,Bangued,
01-OA-000011/01-OA-000043,HOLY SPIRIT ACADEMY (E/HS)-BANGUED,NL,AGC,Parish House,"Bangued, Abra", ,Bangued,
01-AE-000008,HOLY SPIRIT ACADEMY OF LAOAG,NL,AGC,"Bonifacio St.,","Laoag City, Ilocos Norte", , ,
01-AD-000030,SACRED HEART SCHOOL,NL,AGC,"Nera St., Brgy. Central East","Bauang, La Union",FMA - Assumption,LA UNION,
01-AC-000004,CABUGAO INSTITUTE (HS),NL,AGC,"Bonifacio,","Cabugao, Ilocos Sur", , ,
01-AD-000054,UNION CHRISTIAN COLLEGE (E/H),NL,AGC,"Widdeos St.,","San Fernando City, La Union", , ,
01-AE-000005,DON MARIANO MARCOS STATE-LAOAG,NL,AGC,,Laoag City, , ,
01-AB-000008,IMM. CONCEPCION ACADEMY,NL,AGC,"1-S Barangay Valdez, Poblacion","Batac City, Ilocos Norte",SSpS, ,
01-OA-000021,HOLY GHOST SCHOOL,NL,AGC,,"Poblacion, Tayum, Abra", ,Bangued,
01-AC-000076,DIVINE WORD COLLEGE OF VIGAN (HS),NL,AGC,"Burgos St.,","Vigan City, Ilocos Sur",,,
01-AD-000003,AGOO MONTESSORI LEARNING CENTER,NL,AGC,"Aspiras Road Brgy. San Antonio,","Agoo, La Union", , ,
01-OA-000020,HOLY CROSS SCHOOL (E/H),NL,AGC,,"Poblacion, Lagangilang, Abra",,Bangued,
01-AE-000023,SAVIOUR CHRISTIAN ACAD.-LAOAG,NL,AGC,"B. Samonte St.,",Laoag City, , ,
01-OC-000040,PINES CITY COLLEGES (E/HS),NL,AGC,"Magsaysay Ave.,",Baguio City,,,
01-AC-000027,NARVACAN CATHOLIC SCH. (E/HS),NL,AGC,"Sta. Lucia,","Narvacan, Ilocos Sur",RSC,Nueva Segovia,
01-OD-000018/01-OD-000030,SAN JOSE ELEM./HIGH SCHOOL,NL,AGC,"Poblacion,","La Trinidad, Benguet",SIHM,BAGUIO,
01-AE-000010,ILOCOS NORTE COLL. OF ARTS & TRADES,NL,AGC,,Laoag City, , ,
01-AD-000049,ST. PETER SCHOOL OF BAUANG,NL,AGC,"Central East,","Bauang, La Union", ,LA UNION,
01-OD-000003,BENGUET STATE UNIV. LAB ELEM.,NL,AGC,"Km 5,","La Trinidad, Benguet", , ,
01-OD-000028,TWINKLE STAR EDUC'L CHRISTIAN FDT.,NL,AGC,(Frmly Twinkle Star Sch.) Km 5,"Central Pico, La Trinidad, Benguet", , ,
01-AD-000014/01-AD-000089/01-AD-000065,DON MARIANO MARCOS STATE (E/HS)-SN.FD,NL,AGC,"Catbangen,","San Fernando City, La Union", , ,
01-AC-000069/01-AC-000070,UNIV. OF NORTHERN PHIL. (PE/E/HS),NL,AGC,"Laboratory Grade School,Quirino Boulevard","Tamag, Vigan City Ilocos Sur", , ,
01-AB-000005,BATAC JUNIOR COLLEGE,NL,AGC,"San Marcelino St. Brgy Valdez,","Batac City, Ilocos Norte", , ,
01-OD-000025,ST. PAUL'S ACADEMY,NL,AGC,Poblacion,"Sayang, Atok, Benguet", ,BAGUIO,
01-OC-000047,SPECIAL EDUCATION CENTER-BAGUIO,NL,AGC,"Military Cut-off Road.,",Baguio City, , ,
01-AD-000037,ST. CHRISTOPHER ACADEMY (E/HS)*,NL,AGC,"C. East #1,","Bangar, La Union",FAS,LA UNION,
01-AC-000058,STA. CRUZ INSTITUTE,NL,AGC,"Poblacion Sur,","Sta. Cruz, Ilocos Sur",OSS,Nueva Segovia,
01-OC-000012,BAGUIO SEVENTH DAY ADVENTIST SCH. (E/H),NL,AGC,"Lower Bokawkan Rd.,",Baguio City, , ,
01-OC-000067,BAGUIO CENTRAL UNIVERSITY (E/H),NL,AGC,"#18 Bonifacio St.,",Baguio City,,,
01-AD-000083,POLYTECHNIC COLLEGE OF LA UNION,NL,AGC,,"Agoo, La Union", , ,
01-OD-000020,ST. LOUIS HIGH SCH. OF ANTAMOK,NL,AGC,Poblacion,"Antamok, Itogon, Benguet", ,BAGUIO,
01-AC-000059,STA. LUCIA CATHOLIC SCHOOL,NL,AGC,"Burgos,","Sta. Lucia, Ilocos Sur 2712",OSS,Nueva Segovia,
01-OD-000027,ST. THERESE TOMAY (THERESIANS SCHOOL),NL,AGC,(Frmly: Tacdian Catholic School),"Tomay, La Trinidad, Benguet", ,BAGUIO,
01-OD-000022,ST. LOUIS HIGH SCH. OF PHILEX,NL,AGC,"Philex Mines, Pacdal Tuba,",Benguet, ,BAGUIO,
01-AD-000056,UNION INSTITUTE OF ROSARIO,NL,AGC,"Subusud,","Rosario, La Union", , ,
01-AE-000019,NORTHWESTERN UNIV.-LAB. ELEM. SCH.,NL,AGC,"Airport Ave.,",Laoag City, , ,
01-AC-000002,BENITO SOLIVEN ACADEMY (HS),NL,AGC,Brgy Nalasin,"Sto. Domingo, Ilocos Sur", ,Nueva Segovia,
01-OC-000021,EDUCARE LEARNING CENTER,NL,AGC,Km 6,"Irisan, Baguio City", , ,
01-AE-000011,KIDS KOLLEGE,NL,AGC,"2-B Castro Ave.,",Laoag City, , ,
01-AD-000027/01-AD-000028,PUGO CATHOLIC SCHOOL (E/HS),NL,AGC,"Pugo Road, Tavora East,","Pugo, La Union",TDM,LA UNION,
01-AD-000078/01-AD-000094,DON MARIANO MARCOS STATE-AGOO,NL,AGC,"Dona Toribia Aspiras Road,","Agoo, La Union", , ,
01-AB-000006,"DINGRAS FAITH ACADEMY, INC.",NL,AGC,"Root St. Madamba,","Dingras, Ilocos Norte", , ,
01-AD-000024,NOTRE DAME INSTITUTE (HS),NL,AGC,"Poblacion,","Aringay, La Union", ,LA UNION,
01-OC-000061,STEP LEARNING ACADEMY,NL,AGC,109 Brgy. Ferdinand,"Campo Sioco, Baguio City", , ,
01-AB-000034,GRACELAND SAVIOUR'S INSTITUTION,NL,AGC,(Frmly Our Savior Kindergaten of Batac ),"#35 Bil-loca, Batac City, Ilocos Norte", , ,
01-AD-000036,ST. AUGUSTINE LEARNING SCHOOL,NL,AGC,E Rimanto St. Brgy Natividad,"Naguilian, La Union", ,LA UNION,
01-OD-000036,LA TRINIDAD NAZARENE LEARNERS CENTER,NL,AGC,"Pico,","La Trinidad, Benguet",,,
01-AD-000046,ST. MARY'S ACAD.-ROSARIO(HS),NL,AGC,Bernal St.,"Rosario, La Union", ,LA UNION,
01-OA-000034,SACRED HEART SCHOOL-BANGUED,NL,AGC,Zone 6,"Bangued, Abra", , ,
01-OE-000006,IMM. CONCEPCION SCHOOL,NL,AGC,,"Banaue, Ifugao", , ,
01-AC-000034,SAN JOSE HIGH SCHOOL (HS),NL,AGC,,, ,Nueva Segovia,
01-AC-000055,ST. THOMAS AQUINAS LEARNING CENTER,NL,AGC,"21 Libertad Street, Poblacion,","Vigan City, Ilocos Sur", , ,
01-AE-000003/01-AE-000004,DIVINE WORD COLL. OF LAOAG-E/H,NL,AGC,"Gen. Segundo Ave.,",Laoag City,SVD,Laoag,
01-AE-000009,ILOCOS NORTE ADVENTIST SCHOOL,NL,AGC,Brgy. 19,"F. Guerrero St., Laoag City",SDA NL, ,
01-OC-000055,LOAKAN BAPTIST CHURCH SCHOOL,NL,AGC,"#01 Cudirao,","Loakan Proper, Baguio City", , ,
01-OA-000031/01-OA-000045,OUR LADY OF LOURDES HIGH SCHOOL (PE/HS),NL,AGC,,"Manabu, Abra",,Bangued,
01-OC-000002,BAGUIO ACHIEVERS' ACADEMY,NL,AGC,"#15 S. Laurel St.,",Baguio City, , ,
01-OC-000009,"BAGUIO HIGHER GROUND PRE-SCHOOL, INC.",NL,AGC,Pidawan (EPZA),"Loakan Proper, Baguio City", , ,
01-OD-000026,ST. THERESITA'S HIGH SCHOOL,NL,AGC,Poblacion,"Labueg, Kapangan, Benguet", ,BAGUIO,
01-AD-000099,ST. MICHAEL ARCHANGEL LEARNING CENTER,NL,AGC,"Poblacion,","Bacnotan, La Union",,LA UNION,
01-AD-000039,ST. JOHN THE BAPTIST SCHOOL,NL,AGC,MacArthur Highway,"Caba, La Union", ,LA UNION,
01-AB-000036,ST. NICOLAS ACADEMY-ILOCOS NORTE,NL,AGC,,"Vintar, Ilocos Norte", , ,
01-AC-000038,SANTIAGO CATHOLIC SCHOOL (HS),NL,AGC,,"Santiago, Ilocos Sur", ,Nueva Segovia,
01-AD-000093,SAN ALBERTO MAGNO ACADEMY (E),NL,AGC,Poblacion,"Tubao, La Union", ,LA UNION,
01-OD-000013,LITTLE FLOWER CHILDREN'S HOME,NL,AGC,"Km 4,","La Trinidad, Benguet", ,Bangued,
01-OA-000046,BASIC CLUES CREATIVE LEARNING CENTER,NL,AGC,"2nd Flr VP Skyview Bldg.,","Magallanes St., Zone 5, Bangued, Abra",,,
01-AC-000010,GREAT HEIGHTS LEARNING CENTER,NL,AGC,"Ground Flr. Marinella Comm'l Complex,","Govantes Dike, Zone V,Bantay, Ilocos Sur", , ,
01-OD-000012,IMM. CONCEPCION SCHOOL OF BENGUET,NL,AGC,Poblacion,"Bokod, Benguet", ,BAGUIO,
01-AD-000047,ST. MARY'S OF THE SEA ACADEMY,NL,AGC,Centro,"Sto. Tomas, La Union", ,LA UNION,
01-AD-000053,STELLA MARIS ACADEMY (HS),NL,AGC,"Quirino,","Bacnotan, La Union", ,LA UNION,
01-AE-000024,ST. JOSEPH HIGH SCHOOL (E/HS),NL,AGC,"Brgy. 28, Diego Silang St.,",Laoag City, ,Laoag,
01-AB-000018,ST. ELIZABETH ELEM. SCHOOL,NL,AGC,,"Badoc, Ilocos Norte", ,Laoag,
01-AD-000077,UNION SCHOOL OF NAGUILIAN (E/HS),NL,AGC,,"Naguilian, La Union", , ,
01-AB-000023/01-AB-000024,STA. ROSA ACADEMY (E/HS),NL,AGC,"Brgy 3, San Ildefonso","San Nicolas, Ilocos Norte", ,Laoag,
01-AC-000048,ST. CECILIA LEARNING CENTER,NL,AGC,"Brgy. San Nicolas,","Candon City, Ilocos Sur", , ,
01-OD-000017/01-OD-000033,SAN ISIDRO HIGH SCHOOL,NL,AGC,,"Abatan, Buguias, Benguet", ,BAGUIO,
01-AC-000044,ST. AGNES SCHOOL (E/HS),NL,AGC,,, ,Nueva Segovia,
01-AD-000002,AGOO CHRISTIAN LEARNING CENTER,NL,AGC,"#29 San Antonio,","Agoo, La Union", , ,
01-OD-000016,SACRED HEART HIGH SCHOOL,NL,AGC,Poblacion,"Itogon, Benguet", ,BAGUIO,
01-AC-000043,SHEPHERD KIDDIE SCHOOL,NL,AGC,"Brgy. San Jose,","Candon City, Ilocos Sur", , ,
01-AB-000032,OUR SAVIOR'S KINDERGARTEN-PASUQUIN,NL,AGC,,"Brgy. 4, Pasuquin, Ilocos Norte", , ,
01-AE-000025,ST. MARY'S SEMINARY (HS),NL,AGC,"38-A Mangato St.,",Laoag City, , ,
01-OA-000006,AVE MARIA SCHOOL,NL,AGC,"Partelo St.,","Bangued, Abra", , ,
01-OD-000021,ST. LOUIS HIGH SCH. OF BALATOC,NL,AGC,"Virac,","Itogon, Benguet", ,BAGUIO,
01-AE-000020,PADRE ANNIBALE SCHOOL,NL,AGC,"Madre Nazarena Domus,","Along Vintar Rd., Laoag City",FDZ,Laoag,
01-AB-000016,ST. ANDREW ACADEMY (HS),NL,AGC,"Brgy. I,","Bacarra, Ilocos Norte", , ,
01-AB-000033,ST. JOSEPH EDUCATIONAL CTR. OF DINGRAS,NL,AGC,,"Dingras, Ilocos Norte", , ,
01-AC-000061,THE NEW MAKIL TECHNICAL SCHOOL,NL,AGC,"Poblacion,","Galimuyod, Ilocos Sur", , ,
01-AD-000052,STA. CATALINA ACADEMY,NL,AGC,Valdez St.,"Victoria, Luna, La Union", ,LA UNION,
01-OA-000047,ANARAAR KEN NAMNAMA LEARNING ANGELS CTR.,NL,AGC,"Alzate Cmpd., Zone 1,","Linasin, Bangued, Abra",,,
01-AB-000035,THE RIVERDEEP ACADEMY,NL,AGC,"Brgy. 28 Cabusligan,","Bacarra, Ilocos Norte", , ,
01-OD-000015,"RAINBOW MISSION INTERNATIONAL ACAD., INC.",NL,AGC,"AE-13-2 Western Buyagan,","La Trinidad, Benguet", , ,
01-AC-000018,IMM. CONCEPCION MINOR SEM. HS,NL,AGC,"Ayusan Sur,","Vigan City, Ilocos Sur", , ,
01-OD-000032,PHILIPPINES ASIA BIBLE COLLEGE FDT. INC.,NL,AGC,"JD-087-1 Bayabas Pico,","La Trinidad, Benguet", , ,
01-AC-000071,VIGAN ADVENTIST MULTIGRADE SCHOOL,NL,AGC,Capangpangan,"Vigan, Ilocos Sur",SDA NL, ,
01-OD-000019,SHEKINAH EDUCATIONAL CENTER,NL,AGC,"JB 132 Km. 4 Central Pico,","La Trinidad, Benguet", , ,
01-AD-000050,ARINGAY SCHOOL OF SCI. ARTS TECH.&TRADE,NL,AGC,"Raisaville Subd., San Eugenio,","Aringay, La Union", , ,
01-AB-000030,ST. GABRIEL CATHOLIC SCHOOL,NL,AGC,"Poblacion,","Nueva Era, Ilocos Norte", ,Laoag,
01-AB-000037,DONA FRANCISCA SMART KIDS MONT. SCH.,NL,AGC,"#13 San Gabriel Nat'l Rd.,","Bacarra, Ilocos Norte", , ,
01-OA-000013,DIOCESAN SCHOOL OFFICE (A),NL,AGC,Parish House,"Bangued, Abra", , ,
01-AD-000012,DIOCESAN SEMINARY OF HEART OF JESUS,NL,AGC,"San Vicente Road,","San Fernando City, La Union", ,LA UNION,
01-OD-000011,HOLY CROSS LEARNING CENTER - BENGUET,NL,AGC,Lepanto,"Mankayan, Benguet", , ,
01-AC-000073,ANASTROPHE CHRISTIAN SCHOOL,NL,AGC,,, , ,
01-OC-000077,PHILIPPINE BELL INTERNATIONAL SCHOOL,NL,AGC,Near Pink Sister Convent,Baguio City, , ,
01-AC-000072,VIGAN NAN CHONG SCHOOL,NL,AGC,"16 A. Bonifacio St.,","Vigan, Ilocos Sur", , ,
01-OC-000028,JESUS MIRACLE CRUSADE CHRISTIAN ACAD.,NL,AGC,"448 Naguillan Rd., Purok 18,","Irisan, Baguio City", , ,
01-AC-000005,CALVARY BAPTIST ACADEMY OF VIGAN,NL,AGC,"#66 Bonifacio St.,","Vigan City, Ilocos Sur", , ,
01-OC-000072,YALE IL INTERNATIONAL SCHOOL,NL,AGC,"ISG Poliwes,","Kennon Rd., Baguio City", , ,
01-OA-000024,UCCP CHILD CARE CENTER-PTR. HECTOR REYES,NL,AGC,"cor. Santiago & Bowen Sts.,","Bangued, Abra", , ,
01-AD-000033,ST. NICHOLAS ACADEMY (K) -BALAOAN,NL,AGC,"Manila North Road, Brgy Dr Camilo Osias","Balaoan, La Union", ,,
01-OA-000044,ST. IGNATIUS DE LOYOLA SCHOOL,NL,AGC,"13 Mc-Kinley St.,","Zone II, Bangued, Abra", , ,
01-OG-000006,BONTOC FUNDAMENTAL BAPTIST ACADEMY,NL,AGC,,, ,,
01-AD-000031,ST. ISIDORE ELEMENTARY SCHOOL,NL,AGC,Frmly: SAN ALBERTO MAGNO ACADEMY,"Poblacion, Tubao, La Union", ,,
01-AD-000092,ESCUELA DE SAN JUAN,NL,AGC,Centro,"San Juan, La Union", ,LA UNION,
01-AD-000043,ST. MARTIN DE PORRES ACADEMY,NL,AGC,Centro,"Damortis, Rosario, La Union", ,LA UNION,
01-AC-000030,PATER NOSTER LEARNING CENTER (VEC),NL,AGC,(Vigan-Edu-Cultural LRNG. CTR.),"Crisologo St.,Vigan, Ilocos Sur", , ,
01-AE-000028,LAOAG FOURSQUARE KINDERGARTEN SCHOOL,NL,AGC,,, , ,
01-AC-000075,ILOCOS SUR NATIONAL HIGH SCHOOL,NL,AGC,,, , ,
01-OA-000029,OUR LADY OF FATIMA SCHOOL,NL,AGC,St. Narciso Parish,"Bucay, Abra 2805", ,Bangued,
01-AE-000027,UCCP LEARNING CENTER-LAOAG,NL,AGC,"18 Rizal St.,",Laoag City, , ,
01-OD-000023,ST. LOUIS HIGH SCH. OF SABLAN,NL,AGC,,"Poblacion, Sablan, Benguet", ,BAGUIO,
01-OD-000008,CORDILLERA-CARABALLO BIBLE INST.(CCBI),NL,AGC,(CCBI Kiddy Adventure Center),"Brgy. Virac, Itogon, Benguet", , ,
01-AC-000013,ILOCOS BIBLICAL BAPTIST ACADEMY,NL,AGC,,"Taleb Bantay, Ilocos Sur", , ,
01-OA-000023,DIFFERENT STROKES PREPARATORY SCH. INC.,NL,AGC,"668 Lazala St.,","Bangued, Abra", , ,
01-AB-000038,ST. JAMES ACADEMY,NL,AGC,"Manila North Road, Centro","Pasuquin, Ilocos Norte",,,
01-OC-000027,HOLY ANGEL NURSERY SCHOOL,NL,AGC,"#149 Bonifacio St.,","Cuesta Bldg., Baguio City", , ,
01-AB-000031,FLORENTINO CAMAQUIN ELEM. SCHOOL,NL,AGC,"#4 St. Mary,","Vintar, Ilocos Norte", , ,
01-AC-000022,KIDDIE CHRISTIAN LEARNING CENTER,NL,AGC,"#79 Bonifacio St.,","Vigan, Ilocos Sur", , ,
01-AC-000009,DUDLEY S. LARA EDUCATIONAL CENTER,NL,AGC,"#91 Bonifacion St.,","Vigan, Ilocos Sur", , ,
01-AE-000002,CATERPILLAR CENTRE FOR EARLY,NL,AGC,"23 P. Gomez St.,",Laoag City, , ,
01-AD-000070,SAN LORENZO SCIENCE SCHOOL,NL,AGC,"27 Ilang-Ilang St., Capitol View","Poro, San Fernando, La Union", , ,
01-AC-000003,BIDBIDAY ADV. MULTIGRADE SCHOOL,NL,AGC,"Brgy. Bidbiday,","Galimuyod, Ilocos sur", , ,
01-OC-000063,UCCP KINDERGARTEN SCHOOL,NL,AGC,Burnham Park,Baguio City, , ,
01-OD-000004,BRILLIANT CHRISTIAN ACADEMY,NL,AGC,"Km-6 Valley Bread,","La Trinidad, Benguet", , ,
01-AC-000024,LITTLE ANGEL LEARNING CENTER,NL,AGC,"Poblacion,","Narvacan, Ilocos Sur", , ,
01-OE-000008,ST. JOSEPH SCHOOL,NL,AGC,"Poblacion,","Kaingan, Ifugao", , ,
01-AC-000062,THE UNITED METHODIST CHURCH KID,NL,AGC,"San Antonio,","Candon, Ilocos Sur", , ,
01-AC-000066,UCCP N & K SCHOOL-CANDON,NL,AGC,"San Jose,","Candon, Ilocos Sur", , ,
01-AC-000064,UCCP KIDDIE LEARNING CENTER-CABUGAO,NL,AGC,"UCCP Church,","Cabugao, Ilocos Sur", , ,
01-OA-000022,HOLY INFANT LEARNING CENTER,NL,AGC,"Zone 7,","Bangued, Abra", , ,
01-AB-000022,ST. JUDE HIGH SCHOOL,NL,AGC,,"Pagudpud, Ilocos Norte", ,Laoag,
01-AC-000011,HOLY ANGEL LEARNING CENTER,NL,AGC,,"Candon, Ilocos Sur", , ,
01-AC-000025,MAGSINGAL INSTITUTE,NL,AGC,,"Magsingal, Ilocos Sur", , ,
01-AC-000060,TAGUDIN ADVENTIST MULTIGRADE SCHOOL,NL,AGC,,"Tagudin, Ilocos Sur",SDA NL, ,
01-AC-000065,UCCP KINDERGARTEN LRNG. CTR.-SINAIT,NL,AGC,,"Sinait, Ilocos Sur", , ,
01-AC-000067,UNITED METHODIST SCHOOL-CANDON,NL,AGC,,"Candon, Ilocos Sur", , ,
01-AD-000001,AGOO ACADEMY (HS),NL,AGC,,"Agoo, La Union", , ,
01-AD-000029,ROSARIO CENTRAL SCHOOL,NL,AGC,,"Rosario, La Union", , ,
01-AD-000034,SAYTAN ELEMENTARY SCHOOL,NL,AGC,,"Pugo, La Union", , ,
01-OA-000037,ST. JOSEPH'S SEMINARY (HS),NL,AGC,,"Bangued, Abra", , ,
01-OC-000016,BRIDGES TUTORIAL'S LEARNING CENTER,NL,AGC,,"#81 Laurel St., Baguio City", , ,
01-OC-000069,VALLEY KIDDIE LANGUAGE CENTER,NL,AGC,,Baguio City, , ,
01-OD-000029,VALLEY KIDDIE LEARNING CENTER,NL,AGC,,"La Trinidad, Benguet", , ,
01-CG-000037,DON BOSCO ACADEMY (E/HS),NL,CRU,"Green Meadow Subd., Mabiga,","Mabalacat, Pampanga",SDB,,
01-NA-000182,MYSTICAL ROSE SCHOOL OF KALOOKAN,NL,CRU,"Metrocom Homes, Almar Subd.,","Camarin, Kalookan City", , ,
01-NA-000087,GUARDIAN ANGEL SCHOOL,NL,CRU,"P. Samson Road,","Deparo, Kalookan City", , ,
01-CB-000039/01-CB-000040,JOSE RIZAL INSTITUTE (E/HS),NL,CRU,"San Vicente,","Orion, Bataan", , ,
01-CB-000009,BATAAN MONTESSORI SCHOOL,NL,CRU,"Maluya cor A. Banzon St.,","Central, Balanga City, Bataan", , ,
01-NA-000091,HOLY ANGEL SCHOOL OF CALOOCAN,NL,CRU," B-1 L-23-26 Hillcrest Village,","Camarin Rd., Kalookan City", , ,
01-CG-000009,ASSUMPTA TECHNICAL HIGH SCHOOL,NL,CRU,"Sta. Monica,","San Simon, Pampanga",RA,,
01-CB-000085/01-CB-000086,T. DEL ROSARIO COLLEGE (E/HS),NL,CRU,"Capitol Drive,","Balanga, Bataan", , ,
01-NA-000202,OUR LORD'S ANGEL SCHOOL,NL,CRU,"1117 Bagumbong Dulo St.,","Bagumbong, Kalookan City", , ,
01-NA-000097,HOLY INFANT MONTESSORI SCHOOL,NL,CRU,"#4 Ninang Helen, BF Homes, Ph. I & II","Novaliches, Kalookan City", , ,
01-CA-000012,BRIGHTWOOD SCHOOL,NL,CRU,"Don Angeles St., Angeles City Center,","Pandan, Angeles City", , ,
01-CG-000098,MARY HELP OF CHRISTIAN SCHOOL,NL,CRU,Mabiga,"Mabalacat, Pampanga",FMA - Christians, ,
01-CB-000005,BATAAN CHRISTIAN SCHOOL - PILAR,NL,CRU,"Pilar Shopping Arcade,","Pilar, Bataan", , ,
01-CA-000007,ANGELES SPED CENTER,NL,CRU,"Jesus Street,","Pulong-Bulo, Angeles City", , ,
01-CG-000008,ASIAN MONTESSORI CENTER,NL,CRU,"San Agustin, (near Jonafer Mall)","San Fernando City, Pampanga", , ,
01-CG-000080,JOSE FELICIANO COLLEGE,NL,CRU,"Dau,","Mabalacat, Pampanga", , ,
01-CB-000077,ST. NICHOLAS CATHOLIC SCHOOL,NL,CRU,Poblasyon,"Mariveles, Bataan", ,BATAAN,
01-CG-000158,ST. MARY'S ANGEL SCHOOL OF PAMPANGA,NL,CRU,"San Pedro, Mexico Boundary &","Sta. Ana, Pampanga", , ,
01-CI-000049,STA. CRUZ ACADEMY (HS),NL,CRU,sta cruz,Zambales, ,IBA,
01-CG-000179,SURE VALUES LEARNING SCHOOL,NL,CRU,"2nd Floor Fiesta Market. Bldg.,","V. Tiomico St.,San Fernando, Pampanga", , ,
01-CB-000052,MOTHER MARGHERITA DE BRINCAT CATH. SCH.,NL,CRU,"Kamias Rd., Brgy. Tucop,","Dinalupihan, Bataan",Franciscan sisters of Heart of Jesus, ,
01-CB-000048,LLAMAS MEMORIAL INSTITUTE (HS),NL,CRU,"Lacandula St.,","Mariveles, Bataan", , ,
01-NA-000279,SYSTEM PLUS COMPUTER COLL.-E/H,NL,CRU,"141-143 10th Ave.,","6 & 7 St., Kalookan City", , ,
01-CB-000016,BLESSED REGINA PROTMANN,NL,CRU,"Mt. View,","Mariveles, Bataan", ,BATAAN,
01-NA-000248,ST. ANTHONY NOVA SCHOOL (E/HS),NL,CRU,Amparo Subdivision,"Novaliches, Kaloocan City", , ,
01-NA-000074,GOLDEN LINK SCHOOL,NL,CRU,"Waling-Waling cor Dona Aurora St.,","Brgy. 177, Camarin, Kalookan City", , ,
01-CB-000034/01-CB-000033,HOLY ROSARY PAROCHIAL INST.(E/H),NL,CRU,oblsyon,"Orani, Bataan", ,BATAAN,
01-CI-000009,FIRST CHILD LEARNING CENTER,NL,CRU,"7931 A & B Manila Ave.,","Sabcum, Subic Bay, Zambales", , ,
01-CG-000029,CHRISTIAN VISION ACADEMY,NL,CRU,sta lucia resettlement,"Magalang, Pamp.", , ,
01-CI-000040,ST. ANTHONY ACADEMY,NL,CRU,"Matain,","Subic, Zambales", ,IBA,
01-CB-000088/01-CB-000089,THE PENINSULA SCHOOL (E/HS),NL,CRU,"Alangan,","Limay, Bataan", , ,
01-CG-000187,DAU CENTRAL ELEM. SPED,NL,CRU,,"Dau, Mabalacat, Pampanga", , ,
01-CA-000066,ROYAL INTERNATIONAL SCHOOL,NL,CRU,"Lot 9-10 Blk 3-13, Ramon Dizon St.,","Diamond Subd., Balibago, Angeles City", , ,
01-CB-000037,JESUS SAVES LEARNING FOUNDATION,NL,CRU,"Mabuco,","Hermosa, Bataan", , ,
01-CB-000080,ST. PETER OF VERONA SCHOOL,NL,CRU,Poblasyon,"Hermosa, Bataan",SFIC,BATAAN,
01-NA-000253,ST. DOMINIC SAVIO COLL.-PANGARAP,NL,CRU,"Blk 1 Lot 6, Mt. Heights Subd.,","Quirino H-way,Pangarap,Kalookan City", , ,
01-CA-000051,LIVING STONE INTERNATIONAL SCHOOL,NL,CRU,"43-B Marlim Blvd.cor Debra St.,","Pulung Marugal, Angeles City", , ,
01-CB-000008,BATAAN LEARNING SCHOOL,NL,CRU,"Kaparangan,","Orani, Bataan", , ,
01-CF-000025,SBMA SPED EDUCATION CENTER,NL,CRU,"Kalayaan Ave., SBMA,","Subic Bay Freeport,Olongapo City", , ,
01-CB-000067,ST. CATHERINE OF SIENA ACADEMY,NL,CRU,"Brgy San Roque,","Samal, Bataan", ,BATAAN,
01-CG-000036,DOMINICAN SCHOOL-STA. RITA,NL,CRU,"San Matias,","Sta. Rita, Pampanga",OP DOMINICAN, ,
01-CG-000048,FILBERN SCHOOL,NL,CRU,"Suborvia Maimpis, Sindalan,","San Fernando, Pampanga", , ,
01-CG-000007,ARAYAT INSTITUTE (HS),NL,CRU,poblacion,"Arayat, Pampanga", , ,
01-CB-000076,ST. MICHAEL THE ARCHANGEL ACADEMY,NL,CRU,(Formerly Holy Child Cath. Sch.),"Orion, Bataan", ,BATAAN,
01-NA-000050,DIVINE MERCY COLLEGE FDT.(E/H),NL,CRU,"#129 University Ave.,",Kalookan City, ,,
01-CG-000034,DOMINICAN KIDDIE SCHOOL-MEXICO,NL,CRU,Sto. Domingo,"Mexico, Pampanga", , ,
01-CG-000058,GREAT SHEPHERD CHRISTIAN ACADEMY,NL,CRU,"1st Gate, Mawaque Resettlement,","Mabalacat, Pampanga", , ,
01-CB-000026,ECUMENICAL LEARNING CTR.-BALANGA,NL,CRU,"Capitol Drive,","Balanga, Bataan", , ,
01-CB-000002,ASIA PACIFIC COLLEGE OF ADVANCE STUDIES,NL,CRU,"A.H. Banzon St.,","Ibayo, Balanga City, Bataan", , ,
01-CG-000217,NASAH CENTER FOR LEARNING,NL,CRU,"Maligaya St., Sindalan,","City of San Fernando, Pampanga",,,
01-CI-000038,SAN ANDRES SCHOOL OF MASINLOC,NL,CRU,"Olondriz St., Poblacion,","Masinloc, Zambales", ,IBA,
01-NA-000222,RIDGEWOOD SCHOOL OF KALOOKAN,NL,CRU,"(Tiny Rolls Mont.)B-31 L-27, Acacia St.","Rainbow V,Bagumbong, Nova., Kal. City", , ,
01-CF-000026,ST. ANNE ACADEMY (E/HS)-OLONGAPO CITY,NL,CRU,"Gordon Heights,",Olongapo City,,IBA,
01-CA-000069,SCH. OF THE HOLY CHILD,NL,CRU,Villa Angelina Subdivision,Angeles City, , ,
01-CG-000084,LA VERDAD CHRISTIAN SCHOOL,NL,CRU,,"Sampaloc St., Apalit, Pampanga", , ,
01-CF-000019,OLONGAPO CITY CHRISTIAN SCHOOL,NL,CRU,"#5 J.L. Gordon Ave., Ext.,","East, Olongapo City", , ,
01-CI-000050,STA. MONICA PAROCHIAL SCHOOL,NL,CRU,poblacion,"Botolan, Zambales",OP - St. Joseph the Worker,IBA,
01-CG-000033,DIVINE WISDOM SCHOOL,NL,CRU,"Resettlement Area,","Floridablanca, Pampanga", , ,
01-CG-000103,MEXICO ECUMENICAL KIDDIE SCHOOL,NL,CRU,(United Methodist Church)Poblacion,"Parian, Mexico, Pampanga", , ,
01-CI-000010,GOOD SHEPHERED ECUMENICAL LRNG. CTR.,NL,CRU,libertadbst.,"San Narciso, Zambales", , ,
01-CG-000101,MC EWEN'S SCHOOL,NL,CRU,290 San Isidro,"Floridablanca, Pampanga", , ,
01-CB-000100,CABCABEN ELEMENTARY SCHOOL,NL,CRU,,, , ,
01-CA-000005,ANGELES CITY SCIENCE HIGH SCHOOL,NL,CRU,(back of Angeles Univ. Foundation),Angeles City, , ,
01-CG-000122,"PRAYING HANDS KIDDIE CENTER, INC.",NL,CRU,"67 San Isidro,","City of San Fernando, Pampanga", , ,
01-CI-000001,ALDERSGATE LEARNING CENTER,NL,CRU,"San Juan,","Castillejos, Zambales", , ,
01-CA-000057/01-CA-000058,NAZARENE ACADEMY (E/HS),NL,CRU,"Sampaguita Rd., Dona Agripina Subd.,",Angeles City, , ,
01-CG-000130,SAN FERNANDO ECUMENICAL KIDDIE GARDEN,NL,CRU,"Consunji St.,","San Fernando, Pampanga", , ,
01-CI-000015,IBA KIDDIELAND MONTESSORI,NL,CRU,zone 6,"Iba, Zambales", , ,
01-CI-000017,IMM. CONCEPCION ACADEMY,NL,CRU,cabangan,Zambales, ,IBA,
01-CG-000180,THE RISEN LORD ECUMENICAL SCHOOL,NL,CRU,"Main Park, Madapdap Resettlement","Ctr., Mabalacat, Pampanga", , ,
01-CI-000056,T.R. YANGCO EDUC'L INST.(E/HS),NL,CRU,t.r yangco st. brgy rizal,"San Antonio, Zambales",OP - St. Joseph the Worker,IBA,
01-CB-000084,SUNNY HILLSIDE SCHOOL,NL,CRU,Ipag,"Ipag, Mariveles, Bataan", , ,
01-NA-000052,DONA AMPARO COMMUNITY CENTER,NL,CRU,"Mabolo St.,","Amparo Village, Kalookan City", , ,
01-CI-000055,SUBIC MONTESSORI SCHOOL,NL,CRU,"Bldg. 737 Labitan St., Central Business","District, Subic Bay Freeport, Zambales", , ,
01-CB-000108,LETRAN SCIENCE HIGH SCHOOL,NL,CRU,"Dominican, Avenue","Abucay, Bataan", , ,
01-NA-000035,CHILD JESUS COLL. OF KALOOKAN,NL,CRU,"Phase 4 Bagong Silang,",Kaloocan City, , ,
01-NA-000016,BEGINNERS DEV'T LEARNING CENTER,NL,CRU,"Ph-3 Pkg. 1, B-12 L-22,","Bagong Silang, Caloocan City", , ,
01-CB-000057,QUEEN MARY LEARNING CENTER,NL,CRU,"Mabini St., Tejero,","Orani, Bataan", , ,
01-CG-000146,ST. ANTHONY COLL. OF TECHNOLOGY (E/HS),NL,CRU,,"Mabalacat, Pampanga", , ,
01-CG-000053,GOLDEN SUNRISE LEARNING CENTER,NL,CRU,"San Nicholas,","Floridablanca, Pampanga", , ,
01-CI-000016,ILWAS ELEM. SPED SCHOOL,NL,CRU,"Ilwas, Nat'l Rd.,","Subic, Zambales", , ,
01-CA-000003,ALDERSGATE ECUMENICAL SCHOOL,NL,CRU,"A. Del Rosario St.,",Angeles City, , ,
01-NA-000112,IMMACULADA CONCEPCION COLL.-CALOOCAN,NL,CRU,"Soldiers Hills III,","Novaliches, Kalookan City", , ,
01-NA-000111,IMM. MOTHER LEARNING CTR.-STA. QUITERIA,NL,CRU,# 38 Tullahan Road,"Sta. Quiteria, Kalookan City", ,,
01-CB-000049,LUAKAN CHILD DEV'T CENTER-DINALUPIHAN,NL,CRU,"Luakan,","Dinalupihan, Bataan", , ,
01-CG-000018,BRILLE ADVANCE DEV'T CTR. FOR CHILDREN,NL,CRU,"Villa Barcelona, Ph-II,","Sindalan, San Fernando, Pampanga", , ,
01-CG-000219,SAN FERNANDO ELEM. SCHOOL,NL,CRU,"B. Mendoza St.,","City of San Fernando, Pampanga",,,
01-CG-000141,SHIELD OF VICTORY CHRISTIAN SCHOOL,NL,CRU,(Jesus Mighty Faith Acad.)Apung Trining,"Lemen's Vill., Mabalacat, Pampanga", , ,
01-CB-000071/01-CB-000072,ST. JOHN ACADEMY (E/HS),NL,CRU,"Rizal St.,","Dinalupihan, Bataan", ,BATAAN,
01-CG-000016,BLUERIDGE SCHOOL,NL,CRU,"Sulipan, San Isidro,","Apalit, Pampanga", , ,
01-CB-000042,KIDS GARDEN LEARNING CENTER,NL,CRU,"St. Francis Village I,","Limay, Bataan", , ,
01-CG-000079,JIL CHRISTIAN SCHOOL-SAN FRND.,NL,CRU,"Greenhills Ave., San Agustin,","San Fernando, Pampanga", , ,
01-CG-000093,MABALACAT CHRISTIAN ACADEMY,NL,CRU,"Bloostone St., Golden Land Subd.,","Mabiga, Mabalacat, Pampanga", , ,
01-CI-000052,SUBIC ECUMENICAL LEARNING CENTER,NL,CRU,"Calapandayan,","Subic, Zambales", , ,
01-NA-000053,E.M. CASTRO EDUCATIONAL FOUNDATION,NL,CRU,"Blk. 5 Lot 30, Soldier Hills III,","Tala, Kalookan City", , ,
01-CB-000013,BEPZ MULTINATIONAL SCHOOL (E/H),NL,CRU,"Cadena de Amor, Bataan Economic Zone,","2106 Mariveles, Bataan", , ,
01-CG-000175,STA. LUCIA ACADEMY,NL,CRU,"Sta. Lucia,","Sasmuan, Pampanga", , ,
01-NA-000280,THE GENTLE SHEPHERD SCHOOL INC.,NL,CRU,"Rainbow Village V, Camarin Rd.","Deparo, Nov., Kalookan City", , ,
01-CG-000045,ESCUELA DEL NINO DE ORO,NL,CRU,"Villa Isabel, Sindalan,","San Fernando City, Pampanga", , ,
01-CB-000102,HOLY FAMILY LEARNING CENTER,NL,CRU,"Gen. Luna St., Poblacion,","Dinalupihan, Bataan", , ,
01-CF-000004,CHRISTIAN BAPTIST ACADEMY,NL,CRU,"cor. Keith & Acacia Sts.,","Gordon Heights.,Olongapo city", , ,
01-CG-000005,ECUMENICAL KIDDIE LANE-APALIT,NL,CRU,"(Ecumenical Kiddie Lane)Lourdes St.,","San Juan, Apalit, Pampanga", , ,
01-CF-000035,CABALAN CHRISTIAN SCHOOL,NL,CRU,"Purok 3, Nat'l Highway,","New Cabalan, Olongapo City", , ,
01-CB-000068,ST. DOMINIQUE SCHOOL OF LIMAY,NL,CRU,Emerald Coast Executive Village,"Limay, Bataan", , ,
01-NA-000152,LOVE & WISDOM LEARNING CENTER,NL,CRU,"Phase I, Package 4, B-62 L-4,","Bagong Silang, Kalookan City", , ,
01-CG-000198,DAUGHTERS OF ST. DOMINIC SCHOOL,NL,CRU,"Sitio Baidbid, Bry. Sepung Bulaun,","Porac, Pampanga", , ,
01-CI-000019,LUCIO ABRIEGO MEMORIAL SCHOOL,NL,CRU,"San Agustin,","Iba, Zambales", , ,
01-CG-000110,NEHEMIAH CHRISTIAN SCHOOL,NL,CRU,"dela Cruz Lim Subd.,","San Francicso,Mabalacat, Pampanga", , ,
01-CA-000085,TRINIDAD SCHOOL-ANGELES,NL,CRU,"Phase III-B, Bagong Silang Subd.,","Cutud, Angeles City", , ,
01-CB-000091,TRINITY ECUMENICAL KIDDIE GARDEN,NL,CRU,,"Calaguiman, Samal, Bataan", , ,
01-CB-000054,MT. VIEW VILLAGE SCHOOL,NL,CRU,"Mayon St., Mt. View Subd.,","Mariveles, Bataan", , ,
