01-CF-000033,WESLEYAN ECUMENICAL SCHOOL,NL,CRU,"Bo. Barretto,","Subic, Zambales", , ,
01-CG-000152,ST. JOHN ACADEMY OF GUAGUA,NL,CRU,"San Juan Bautista,","Betis,  Guagua, Pampanga", , ,
01-CA-000013,C.C.E.M.I. ACADEMY,NL,CRU,"1801 Miracle Ave.,","Villa Dolores Subd., Angeles City", , ,
01-CB-000097,LUAKAN HIGH SCHOOL,NL,CRU,,,, ,
01-NA-000176,MOTHER & CHILD ACADEMY-CAYBIGA,NL,CRU,"#42 Interior,","Gen. Luis St., Caybiga, Kalookan City", , ,
01-CI-000025,MASINLOC CHRISTIAN ACADEMY,NL,CRU,national hway,"Masinloc, Zambales", , ,
01-CG-000017,BRIGHT LIFE (BRIGHT LRNG. INST.,NL,CRU,"Morning Star Subd.,San Pablo,","Guagua, Pampanga", , ,
01-CI-000028,NORTHERN ZAMBALES ACADEMY (E/H),NL,CRU,,"Masinloc, Zambales", , ,
01-CI-000054,SUBIC KIDDIE CHRISTIAN SCHOOL,NL,CRU,"Elwas,","Subic, Zambales", , ,
01-CB-000038,JIL CHRISTIAN SCHOOL-BALANGA,NL,CRU,"Roman Hiway,","Balanga, Bataan", , ,
01-CB-000074,ST. JOSEPH SPED SCHOOL,NL,CRU,,"Dinalupihan, Bataan", , ,
01-CB-000110,NORTHRIDGE MONTESSORI SCHOOL,NL,CRU,"National Rd.,","Panilao, Pilar, Bataan",,,
01-CG-000078,JIL CHRISTIAN SCHOOL-GUAGUA,NL,CRU,"Greenhills Ave., San Agustin church,","San Fernando City, Pampanga", , ,
01-NA-000267,ST. MICHAEL SCHOOL OF KALOOKAN,NL,CRU,(Formerly: Ma. Luzviminda Open)-B-4 L-8,"Almar Subd., Camarin, Kalookan City", , ,
01-CG-000042,ECUMENICAL LRNG. CTR.-ARAYAT,NL,CRU,poblacion,"Arayat, Pampanga", , ,
01-NA-000019,BETHOVEN CHILD LEARNING CENTER,NL,CRU,"621 St. Joseph Ave., Barracks,","Tala, Kalookan City", , ,
01-CB-000019,DAUGHTERS OF ST. DOMINIC SCHOOL-LIMAY,NL,CRU,Emerald Coast Executive Village,"Limay, Bataan", , ,
01-CF-000002,BRIGHTFIELDS MONTESSORI SCHOOL,NL,CRU,"1860 Rizal Ave., EBB",Olongapo City, , ,
01-CA-000017,CHRISTIAN FRIENDSHIP LEARNING CENTER,NL,CRU,"26-13 Amason St., Riverside Subd.,","Friendship, Balibago, Angeles City", , ,
01-CF-000031,THE KING'S ACADEMY,NL,CRU,"16 Coral St.,","Gordon Heights, Olongapo City", , ,
01-CB-000032,HOLY FAMILY CENTER FOR STUDIES,NL,CRU,"Sta. Isabel,","Dinalupihan, Bataan", , ,
01-CB-000058,SAMAL ECUMENICAL LRNG. CTR.(E),NL,CRU,"San Juan,","Samal, Bataan", , ,
01-NA-000174,MOERAE CHRISTIAN ACADEMY,NL,CRU,"Ph.2 Pkg.1 B-2,Bagong Silang,",Kalookan City(infront of B. Silang HS), , ,
01-CI-000064,CHILD DEVELOPMENT CENTER,NL,CRU,san felipe,Zambales, , ,
01-CG-000220,DIAMOND EDUCATIONAL CENTER-DAU,NL,CRU,"Quezon Drive,","Dau, Mabalacat, Pampanga",,,
01-CB-000106,JESUS REIGN CHRISTIAN LEARNING CENTER,NL,CRU,"Bonifacio Village,","Calaylayan, Abucay, Bataan", , ,
01-CB-000096,ST. FRANCIS CATHOLIC SCHOOL OF BATAAN,NL,CRU,,, , ,
01-CG-000026,CHRIST IN YOU FAITH CHRISTIAN ACAD.,NL,CRU,"Dolores Homesite,","San Fernando, Pampanga", , ,
01-CB-000069,ST. JAMES CATHOLIC SCHOOL,NL,CRU,Poblasyon,"Morong, Bataan", ,BATAAN,
01-CB-000098,LIVING ROCK CHILDREN'S CENTER,NL,CRU,,, , ,
01-CB-000104,KALAYAAN COLLEGE,NL,CRU,,, , ,
01-CG-000191,ST. PAUL AMERICAN CHRISTIAN SCHOOL,NL,CRU,,, , ,
01-CG-000046,EVERGREEN SCHOOL,NL,CRU,"Pandacaque Resettlement,","Mexico, Pampanga", , ,
01-CG-000215,SHALOM LEARNING CENTER,NL,CRU,,, , , 
01-CG-000113,NORTHWEST ACADEMY OF PAMPANGA,NL,CRU,"Pulungmasle,","Guagua, Pampanga", , ,
01-CG-000203,"BRIGHT WAYS SCHOOL SYSTEM, INC.",NL,CRU,"279 Argon St., Forthneville,Ph.III,","Panipuan, San Fernando City, Pampanga", , ,
01-NA-000067,GALILEE CHRISTIAN VALUE EDUC'L FDT.,NL,CRU,"#10 Susano Rd.,","Deparo, Nova., Kalookan City", , ,
01-NA-000026,BLESSED LORENZO RUIZ ACADEMY,NL,CRU,"Ph-I B-1 L-23, Roque Bldg.,","Bagong Silang, Caloocan City", , ,
01-CA-000070,SHEKINAH CHRISTIAN SCHOOL,NL,CRU,"Victoria St., San Ignacio Subd.,","Pandan, Angeles City", , ,
01-CI-000063,HOLY FAMILY ACADEMY OF ZAMBALES,NL,CRU,,, , ,
01-CG-000028,CHRISTIAN HOME LEARNING CENTER,NL,CRU,,"Floridablanca, Pampanga", , ,
01-CI-000036,RIVERS OF JOY CHRISTIAN SCHOOL,NL,CRU,"San Vicente, Brgy. San Juan","Narciso, Zambales", , ,
01-CG-000192,"MATINIAN SCHOOL, INC.",NL,CRU,"Magsaysay St., Sto. Nino (Sapa)","Sto. Tomas, Pampanga", , ,
01-CI-000032,PEDRO M. ARCE ECUM. LRNG. CTR.,NL,CRU,national hway,"San Felipe, Zambales", , ,
01-CI-000068,HILDEGARDE VON BINGEN SCIENCE & ARTS HS,NL,CRU,market side,"San Antonio, Zambales",,,
01-CB-000015,BETHEL ECUMENICAL KIDDIE SCHOOL,NL,CRU,"Magsaysay,","Dinalupihan, Bataan", , ,
01-CA-000071,SHEPHERD'S BAPTIST CHRISTIAN ACADEMY,NL,CRU,"251 Josefa St., Josefa Subd.,","Malabanias Rd., Angeles City", , ,
01-BB-000115,ST. CLARE MONTESSORI SCHOOL OF TUGUEG,NL,CRU,"Andrews Village, Certain Centro","Tuguegarao City, Cagayan Valley",,,
01-CG-000214,EXACT COLLEGE OF ASIA,NL,CRU,,, , , 
01-CI-000018,LIVING HOPE ZAMBALES CHRISTIAN ACADEMY,NL,CRU,libertad st.,"San Narciso, Zambales", , ,
01-NA-000043,CORPUZ CHRISTI LRNG. CTR.-KALOOKAN,NL,CRU,"L-16 B-15,Villa Magdalena III,","Camarin Rd., Kalookan City", , ,
01-CG-000193,JC GLORIOUS KINGDOM ACADEMY,NL,CRU,"Poblacion,",Arayat. Pampanga, , ,
01-CG-000197,CLSF-EMMANUEL ACADEMY INC.,NL,CRU,,, , ,
01-CB-000017,CABCABEN KIDDIE SCHOOL,NL,CRU,"Dolores Ext., Cabcaben,","Mariveles, Bataan", , ,
01-CI-000002,ANGELITE CHRISTIAN PRE-SCHOOL,NL,CRU,"3 Macelo St., Asinan,","Poblacion, Subic, Zambales", , ,
01-NA-000232,SAN ROQUE PAROCHIAL SCHOOL,NL,CRU,"10th Ave., cor Mabini St.,",Kalookan City,MCJ,KALOOKAN,
01-NA-000320,RIMBANG EXCELLENT CENTER FOR LEARNING,NL,CRU,"Blk 31 lot 5, Dama de Noche St.,","Capitol Park Homes II, Caloocan City",,,
01-CB-000107,WIZ KIDS TUTORIAL CENTER,NL,CRU,"243 Bagong Daan St.,","Calaylayan, Abucay, Bataan", , ,
01-CG-000188,PULUNG MASLE ECUMENICAL LEARNING CENTER,NL,CRU,,, , ,
01-CG-000043,EMMANUEL CHRISTIAN LRNG. CTR.,NL,CRU,"7003 Siera Madre Ext.,Talimundok,","Dau, Mabalacat, Pampanga", , ,
01-CA-000093,AMEN MISSION CHRISTIAN SCHOOL,NL,CRU,"12-1-B 6TH St.,",Villa Sol Subd. Angeles City,,,
01-CG-000201,MONTESSORI SCHOOL OF MINALIN,NL,CRU,,, , ,
01-CA-000011,BRIGHT STAR LEARNING CENTER,NL,CRU,,"A. del Rosario, Angeles City", , ,
01-CB-000064,SIENA COLLEGE OF HERMOSA,NL,CRU,"A. Rivera Street, Brgy. Balsik,","Hermosa, Bataan",OP-SIENA,,
01-CB-000066,SOLA FIDE MONTESSORI SCHOOL,NL,CRU,"Arellano Ave.,","Orani, Bataan", , ,
01-NA-000307,"KING SOLOMON LEARNING HOME, INC",NL,CRU,68 Barrio San Isidro,"Tala, Caloocan City", , ,
01-CG-000204,AGAPE CHRISTIAN SCHOOL OF FLORIDABLANCA,NL,CRU,,, , ,
01-CB-000051,MARIVELES ECUMENICAL LRNG. CTR.,NL,CRU,(Ecumenical L.c.)Teachers Village,"San Isidro, Mariveles, Bataan", , ,
01-CG-000208,THERESIAN DAY CARE CENTER,NL,CRU,,, , ,
01-CB-000078,ST. NICHOLAS CHILD CARE CENTER,NL,CRU,"P. Burgos St.,","Mariveles, Bataan", , ,
01-CG-000170,ST. THERESE MULTIPLE INTELLIGENCE L.C.,NL,CRU,"Blk 93 Bulaon,","San Fernando City, Pampanga", , ,
01-CI-000011,HANNIEL CHRISTIAN ACADEMY,NL,CRU,"Brgy. Magsaysay,","Castillejos, Zambales", , ,
01-CG-000200,HIS SANCTUARY OF GOD LEARNING CENTER,NL,CRU,,, , ,
01-CB-000109,ACADEMY OF QUEEN MARY,NL,CRU,"Mabini St., Tenejero","Orani, Bataan",,,
01-CB-000001,ASBURY LEARNING CENTER,NL,CRU,"Ibayo,","Abucay, Bataan", , ,
01-CF-000036,KIDS LORIAN CHRISTIAN SCHOOL,NL,CRU,,, , ,
01-CI-000065,JUVENTUS SCHOOL FOR THE GIFTED,NL,CRU,"Bldg 8131 Rizal Gate, Manila Ave.,","Subic Bay Freeport, Subic, Zambales", , ,
01-CB-000023,DISCIPLES HERITAGE LRNG. CTR.,NL,CRU,,"Culis, Hermosa, Bataan", , ,
01-NA-000040,CHRISTIAN GOSPEL KINDER SCHOOL,NL,CRU,"# 41 Katarungan St.,","Bagong Barrio, Kalookan City", , ,
01-CG-000195,STA. LUCIA CATHOLIC LEARNING CENTER,NL,CRU,,, , ,
01-CB-000044,LIMAY COMMUNITY DEV'T CENTER,NL,CRU,,"Limay, Bataan", , ,
01-CB-000073,ST. JOSEPH PRE-SCHOOL,NL,CRU,"#45 P. Paterno St., Poblacion,","Balanga City, Bataan",SFIC, ,
01-CG-000206,SAN MIGUEL ELEMENTARY SCHOOL,NL,CRU,,, , ,
01-CI-000034,PRECIOUS CHILD SCHOOL OF ZAMBALES,NL,CRU,,"Castillejos, Zambales", , ,
01-CG-000108,MOTHER SHEPHERD SCHOOL,NL,CRU,"District 12, Blk 91, Lot 10,","Pandacaqui, Mexico, Pampanga", , ,
01-CG-000051,GOD'S LAMP OF WISDOM LEARNING CENTER,NL,CRU,(Frmly Lamb of Wisdom L.C.),"Capangalan, Apalit, Pampanga", , ,
01-CA-000064,PROVERBSVILLE SCHOOL,NL,CRU,"32-5-7 Flora Ave.,","Cutcut, Angeles City",,,
01-NA-000073,GOLDEN CHILD LEARNING CENTER,NL,CRU,(Frmly: NFWC-San Jose L.C.),"#674 Pag-asa St., Kaloocan City", , ,
01-CB-000030,HERMOSA ECUMENICAL LEARNING CENTER,NL,CRU,San Pedro St.,"Hermosa, Bataan", , ,
01-CB-000095,MARIVELES CHRISTIAN LEARNING CENTER,NL,CRU,"054 Agorita St.,","Brgy. Ipag, Mariveles, Bataan", , ,
01-NA-000326,YWCA-GRACE PARK LEARNING CENTER,NL,CRU,"80 Ma. Clara St.,","3rd Ave., Caloocan City",,,
01-CI-000039,SMART KID MONTESSORI,NL,CRU,"Purok 5, St. James Subd.,","Calapacuan, Subic, Zambales", , ,
01-CI-000012,HOPE KINDERGARTEN ECUMENICAL,NL,CRU,national hway,"Cabangan, Zambales", , ,
01-CG-000040,EAST CENTRAL COLLEGE-SAN FERNANDO,NL,CRU,,, , ,
01-CG-000086,LITTLE ANGEL LRNG. CTR.-MEXICO,NL,CRU,"San Carlos,","Mexico, Pampanga", , ,
01-CB-000090,TORTUGAS LEARNING CTR. FOR CHILDREN,NL,CRU,,"Tortugas, Balanga, Bataan", , ,
01-CG-000140,SHALOM LEARNING CENTER,NL,CRU,"B-6 L-26, Villa Juanita","Sta. Cruz, Porac, Pampanga", , ,
01-CB-000056,ORANI ECUMENICAL KIDDIE GARDEN,NL,CRU,,"Orani, Bataan", , ,
01-NA-000171,MESSIAH CHRISTIAN ACADEMY-BAESA,NL,CRU,"145 Rivera St.,","Baesa Rd., Kalookan City", , ,
01-CG-000166,ST. PETER INSTITUTE,NL,CRU,"Near Municipal Hall,","Apalit, Pampanga", , ,
01-NA-000304,"SANGADAAN CHRISTIAN SCHOOL, INC.",NL,CRU,,, , ,
01-NA-000309,LORD IS MY SHEPHERD LEARNING CENTER,NL,CRU,,, , ,
01-NA-000083,GRECIAN LEARNING CENTER,NL,CRU,"664 Area A,","Camarin, Kalookan City", , ,
01-CB-000105,3R'S KIDDIE HOME CENTER,NL,CRU,#3 ECS Apartment Batumbakal,"Tenejero, Balanga City", , ,
01-NA-000127,KIDS AT SCHOOL LEARNING CENTER,NL,CRU,442 Samguita St.,"East Barrio, Kalookan City", , ,
01-CB-000014,BETHANY CHILD DEV'T CENTER,NL,CRU,"Palihan,","Hermosa, Bataan", , ,
01-CG-000081,JUON REYS LEARNING CENTER,NL,CRU,"Bonifacio Ave., Pilar Village,","San Fernando, Pampanga", , ,
01-CG-000207,CHILDREN'S LEARNING CENTER (CLC),NL,CRU,,, , ,
01-CB-000103,MARIFER SCHOOL OF DIVINE LIGHT,NL,CRU,,, , ,
01-CA-000041,IMS LEARNING CENTER,NL,CRU,"1478 Yakal St.,","L & S Subd., Angeles City", , ,
01-CG-000196,JESUS THE LAMB OF GOD LEARNING CENTER,NL,CRU,,, , ,
01-NA-000163,MARIONS CHILD LEARNING CTR. (MICAH'S),NL,CRU,,, , ,
01-CI-000069,PNOWA CHILD LEARNING CENTER,NL,CRU,Phil. Navy Officers Wives Association,"San Antonio, Zambales",,,
01-NA-000077,GRACE CHILDREN DEV'T CENTER,NL,CRU,679 Rizal Avenue Extension,"Monumento, Kalookan City", , ,
01-CB-000018,COLL. OF THE MOST HOLY TRINITY,NL,CRU,"Brgy. Sacrifice Valley,","Hermosa, Bataan", , ,
01-CG-000131,SAN FERNANDO SIN-SENG SCHOOL,NL,CRU,"Mc-Arthur Hiway, San Jose,","San Fernando, Pampanga",,,
01-NA-000120,JOY LEARNING CENTER,NL,CRU,"# 23 C. Namie St., R. Papa,",Caloocan City, , ,
01-NA-000239,SAVIOUR CHRISTIAN ACADEMY,NL,CRU,"11 Milagrosa St., Malolos Ave.,","Bagong Barrio, Kalookan City", , ,
01-NA-000093,HOLY CHILD SCHOOL OF KALOOKAN,NL,CRU,"2245 Zapote St., Area D,","Camarin II, Brgy 178, Kalookan City", , ,
01-NA-000180,MT. OLIVES LEARNING & DEV. CTR.,NL,CRU,"5674 Pili St., Area D,","Camarin, Novaliches, Kalookan City", , ,
01-NA-000260,ST. JOHN SCHOOL OF BAGONG SILANG,NL,CRU,Blk 87 Lot 12 Phase 8-B,"Bagong Silang, Kalookan City", , ,
01-NA-000170,MELENDRES ACADEMY,NL,CRU,"Ph-8 A, Package 9, B-141 L-19","Bagong Silang, Kalookan city", , ,
01-NA-000114,INTER FAITH LEARNING CENTER,NL,CRU,"Phase 8, Blk 11 Lot 5,","Bagong Silang, Kalookan City", , ,
01-NA-000095,HOLY HEART OF MARY SCHOOL,NL,CRU,"Phase I, Package 3,","Bagong Silang, Kalookan City", , ,
01-NA-000135,LEARN & WISDOM LEARNING CENTER,NL,CRU,"PHI Package IV,","Bagong Silang, Kalookan City", , ,
01-NA-000240,SCH. OF OUR LADY TRINITY,NL,CRU,"St. Joseph st., Barracks,","Tala, Kalookan City", ,,
01-CC-000106,DR. YANGA'S F.BALAGTAS COLLEGE,NL,HER,Wakas,"Bocaue, Bulacan", , ,
01-CC-000071,COLEGIO DE CALUMPIT (CALUMPIT INSTITUTE),NL,HER,(Frmly: Calumpit Institute),"Calumpit, Bulacan", , ,BULPRISA
01-CC-000110,EBENEZER MONTESSORI SCHOOL,NL,HER,Sto. Cristo,"San Jose Del Monte, Bulacan", , ,
01-CC-000185,HOLY SPIRIT ACADEMY (E/HS)-BULACAN,NL,HER,"Sta. Isabel,","Malolos, Bulacan",SSpS,,BULPRISA
01-CC-000214,JIL CHRISTIAN COLL.-BOCAUE(E/H),NL,HER,Bunlo,"Bocaue, Bulacan", , ,
01-CC-000083,COL. DE STA. MONICA (E/HS),NL,HER,Poblacion,"Angat, Bulacan", ,,BULPRISA
01-CC-000503,STO. NINO ACADEMY - BOCAUE,NL,HER,Poblacion,"Bocaue, Bulacan", , ,BULPRISA
01-CC-000195,IMM. CONCEPCION SCH. FOR BOYS,NL,HER,Poblacion,"Malolos, Bulacan",,,BULPRISA / MACIPRISA
01-CC-000302,MONT. DE SAGRADA FAMILIA,NL,HER,"B.S. Aquino Ave., Tangos,","Baliuag, Bulacan", , ,BULPRISA
01-CC-000258,LIVING ANGEL CHRISTIAN ACADEMY,NL,HER,"(Formerly Little Angel ) 721 Dalia St.,","Concepcion Subd., Baliuag, Bulacan",,,
01-CC-000471,ST. MARY'S ACADEMY (E/HS)-STO. NINO,NL,HER,Sto. Nino,"Meycauayan, Bulacan",RVM,,BULPRISA
01-CC-000192/01-CC-000193,IMM. CONCEPCION CHILD DEV'T CTR.(E/H),NL,HER,"Poblacion,","Pandi, Bulacan", , ,BULPRISA
01-CC-000475,ST. MARY'S COLL.-MEYCAUAYAN (E/HS),NL,HER,"Saluysoy,","Meycauayan, Bulacan",RVM,,BULPRISA
01-CC-000108,EARLY CHRISTIAN ACADEMY,NL,HER,"#68 R. Merlad St., Poblacion,","Sta. Maria, Bulacan", , ,BULPRISA
01-NQ-000074,NUESTRA SENORA DE GUIA ACADEMY,NL,HER,33 P. Deato SF,"Balangkas, Valenzuela City", , ,VALAPSA
01-CC-000474,ST. MARY'S COLL.-BALIUAG (E/H),NL,HER,"E. Chico St.,","Baliuag, Bulacan",RVM,,BULPRISA
01-CC-000196,IMM. CONCEPCION SCH. OF BALIUAG,NL,HER,"393 R.E. Chico St.,","Baliuag, Bulacan", , ,BULPRISA
01-CC-000377,SACRED HEART ACADEMY (E/H),NL,HER,"T. Santiago St.,","Sta. Maria, Bulacan", , ,BULPRISA
01-CC-000452,ST. JOHN THE BAPTIST CATH. SCH,NL,HER,"Washington St., Poblacion,","Calumpit, Bulacan", ,,BULPRISA
01-CC-000561,IMMACULATE CONCEPTION LEARNING CENTER,NL,HER,"47 A. Bonifacion St.,","Poblacion, Sta. Maria, Bulacan", , ,
01-CC-000332,NOTRE CHRISTI ACADEMY,NL,HER,"950 Kapitan Bindoy St.,","Poblacion, Bustos, Bulacan", , ,
01-CC-000036,BULACAN ECUMENICAL SCH. (E/HS),NL,HER,"Liang St.,","Malolos, Bulacan",, ,BULPRISA / MACIPRISA
01-NQ-000091,SAN DIEGO PAROCHIAL SCHOOL (E/HS),NL,HER,"Polo, Poblacion 1,",Valenzuela City,OP - St. Joseph the Worker,MALOLOS,BULPRISA
01-CC-000446/01-CC-000447,ST. JAMES ACADEMY (E/HS),NL,HER,Poblacion,"Plaridel, Bulacan",OP-SIENA,,BULPRISA
01-CC-000429,ST. ANNE'S CATHOLIC SCHOOL,NL,HER,Poblacion,"Hagonoy, Bulacan", ,,BULPRISA
01-CC-000500,STELLA MARIS ACADEMY,NL,HER,"Valenzuea St.,","Bulihan City, Malolos, Bulacan",, ,MACIPRISA
01-CC-000066/01-CC-000067,CHRISTIAN ECCLESIASTICAL SCH.(E/HS),NL,HER,"Gaya-Gaya,","San Jose Del Monte, Bulacan", , ,BULPRISA
01-CC-000508,STO. ROSARIO COLLEGE,NL,HER,"Area I, Assumption Rd.,","Sapang Palay, Bulacan", ,MALOLOS,BULPRISA
01-CC-000183,HOLY INFANT SCHOOL,NL,HER,"Bagong Bayan, Sta. Isabel,","Malolos, Bulacan",, ,BULPRISA / MACIPRISA
01-CC-000465,ST. MARTIN DE PORRES-GUIGINTO,NL,HER,Poblacion,"Guiginto, Bulacan",OP - St. Joseph the Worker,MALOLOS,BULPRISA
01-CC-000135,GENESIS CHRISTIAN ACADEMY-SJDM,NL,HER,"Gulod, Sapang Palay,","San Jose del Monte, Bulacan", , ,BULPRISA
01-CC-000245,LICEO DI SAN LORENZO,NL,HER,"Km.37 Pulong Buhangin,","Sta. Maria, Bulacan", , ,
01-CC-000307,MONT. SCHOOL OF PULILAN,NL,HER,Poblacion,"Pulilan, Bulacan", , ,BULPRISA
01-CC-000349,PAOMBONG HIGH SCHOOL,NL,HER,,"Paombong, Bulacan", , ,BULPRISA
01-CC-000353,PBC SUNBEAM SCHOOL,NL,HER,"Brgy. Bintog,","Plaridel, Bulacan", , ,
01-CC-000037,BULACAN MONTESSORI SCHOOL,NL,HER,"Bryg. Sta. Ana,","Bulacan, Bulacan", , ,
01-CC-000470,ST. MARY'S ACADEMY (E/HS)-HAGONOY,NL,HER,"(Formerly St. Anne Acad.)- Poblacion,","Hagonoy, Bulacan",RVM,,BULPRISA
01-CC-000451,ST. JOHN SCHOOL-SAN ILDEFONSO,NL,HER,"Sampaguita St., San Juan,","San Ildefonso, Bulacan", , ,BULPRISA
01-CC-000417,SIENA COLLEGE OF SJDM (E/HS),NL,HER,"Gaya-Gaya,","San Jose del Monte, Bulacan",OP-SIENA,,
01-CC-000482,ST. PAUL SCH. (E/HS)-SAN RAFAEL,NL,HER,Pantubig,"San Rafael, Bulacan",SPC,,BULPRISA
01-CC-000226,KALINANGAN INTEGRATED SCHOOL,NL,HER,"017 Sulukan,","Angat, Bulacan", , ,BULPRISA
01-CC-000303,MONT. DE SAN ILDEFONSO,NL,HER,"Quijano Street, Brgy San Juan,","San Ildefonso, Bulacan", , ,BULPRISA
01-CC-000552,ST. DOMINIC DE GUZMAN SCHOOL,NL,HER,Frmly:SANTISSIMO SACRAMENTO CATH SCH,"Caypombo, Sta. Maria, Bulacan",OP - St. Joseph the Worker, ,BULPRISA
01-CC-000481,ST. PAUL COLL. - SAN MIGUEL(E/HS),NL,HER,Poblacion,"San Miguel, Bulacan",SPC,,BULPRISA
01-CC-000340,OUR LADY OF LA SALETTE SCHOOL,NL,HER,"Mountain View, Muzon,","San Jose Del Monte, Bulacan", ,,
01-CC-000593,COLEGIO DE STO. NINO DE BUSTOS,NL,HER,,, , ,
01-CC-000207,JESUS LORD & SAVIOR CHRISTIAN COLL. FDT.,NL,HER,"E. Celestino St.,","Guyong, Sta. Maria, Bulacan", , ,BULPRISA
01-CC-000077/01-CC-000078,COL. DE SAN PASCUAL DE BAYLON-E/HS,NL,HER,Pag-asa,"Obando, Bulacan",,MALOLOS,BULPRISA
01-CC-000294/01-CC-000295,MEYCAUAYAN COLLEGE (E/HS),NL,HER,"Mc-Arthur Hiway,","Meycauayan, Bulacan", , ,BULPRISA
01-CC-000380,SAN BENILDO INTEGRATED SCHOOL,NL,HER,"F. Vergel de Dios St.,","Brgy. Concepcion, Baliuag, Bulacan", , ,BULPRISA
01-CC-000403,SCH. OF MOUNT ST. MARY,NL,HER,"Guillerma Village, Sta. Rita,","San Miguel, Bulacan", , ,
01-CC-000434,ST. CLEMENT ACADEMY,NL,HER,"A. Mabini St., Trinidad,","Malolos, Bulacan",, ,BULPRISA / MACIPRISA
01-CC-000467,ST. MARTIN DE PORRES-PAOMBONG,NL,HER,Poblacion,"Paombong, Bulacan",OP - St. Joseph the Worker,MALOLOS,MAPSA/BULPRISA
01-CC-000289,MATER DEI ACADEMY,NL,HER,"Km. 39, Pulong Buhangin","Sta. Maria, Bulacan", , ,
01-CC-000191,I.S. MONTESSORI SCHOOL,NL,HER,Igulot,"Bocaue, Bulacan", , ,BULPRISA
01-CC-000585,STO. NINO ACADEMY - SAN RAFAEL,NL,HER,"#8 Sampaloc St., Cagayan Rd.,","San Rafael, Bulacan", , ,
01-CC-000443,ST. GABRIEL ACADEMY,NL,HER,"(Frmly: Little Foot LC) 388 F. Cruz St.,","Paltao, Pulilan, Bulacan", , ,BULPRISA
01-CC-000265,LORD'S ANGEL MONTESSORI SCH.-MALOLOS,NL,HER,"130 Dhalia St., Alido Heights","Subd., Malolos, Bulacan", , ,BULPRISA
01-CC-000522,THE HOLY LADY ACADEMY,NL,HER,"(Fmrly Our Lady L.C.) #14 Electron St.,","Meralco Vill. Lias, Marilao,Bulacan", , ,
01-CC-000174,HOLY CHILD MONTESSORI SCHOOL,NL,HER,"#38 Parada,","Sta. Maria, Bulacan", , ,
01-CC-000440,ST. FRANCIS OF ASSISI MONTESSORI,NL,HER,Banga-Banga,"Plaridel, Bulacan", , ,
01-CC-000306,MONT. SCHOOL OF MALOLOS,NL,HER,"245 San Vicente Street, Brgy San Pablo,","Malolos, Bulacan",, ,MACIPRISA
01-CC-000060,CHILD'S FAITH FOUNDATION ACADEMY,NL,HER,"B-12 L-33 Graceville Subd.,","Muzon, San Jose Del Monte, Bulacan", , ,BULPRISA
01-CC-000584,COLLEGE OF OUR LADY OF MERCY,NL,HER,"Rizal St., Longos,","Pulilan, Bulacan", , ,BULPRISA
01-CC-000435,ST. DOMINIC ACADEMY (HS),NL,HER,"Poblacion,","Pulilan, Bulacan",OP-SIENA,,BULPRISA
01-CC-000496,STA. MARIA ECUMENICAL SCHOOL,NL,HER,"Dr. T. Santiago St., Poblacion,","Sta. Maria, Bulacan", , ,BULPRISA
01-CC-000171,HOLY ANGELS ACADEMY (E/H)-PANDI,NL,HER,"Poblacion,","Pandi, Bulacan", , ,BULPRISA
01-CC-000166,HANKINS LEARNING SCHOOL,NL,HER,"Blk 2 Lot 6, Masinop St., Masagana Homes","Ph-I, Sta. Rita, Guiguinto, Bulacan", , ,
01-CC-000490/01-CC-000562,ST. THERESE SCHOOL OF MARILAO,NL,HER,"Bahay Pari, Heritage Homes,","Marilao, Bulacan", , ,
01-CC-000287,MARY THE QUEEN SCHOOL OF MONTESSORI,NL,HER,"F. Estrella St.,","Malolos, Bulacan",, ,BULPRISA / MACIPRISA
01-CC-000466,ST. MARTIN DE PORRES-NORZAGARAY,NL,HER,Poblacion,"Norzagaray, Bulacan",OP - St. Joseph the Worker,MALOLOS,BULPRISA
01-CC-000250,ANGELICAN SCHOOL OF MARILAO,NL,HER,(Frmly:Angelican Academy)6 Sandico St,"Poblacion I,Marilao, Bulacan", , ,
01-CC-000064,CHRISTIAN ACADEMY OF PANDI,NL,HER,"Bunsuran ll,","Pandi, Bulacan", , ,BULPRISA
01-CC-000350,PARKRIDGE SCHOOL OF MONT.,NL,HER,"Kamias,","San Miguel, Bulacan", , ,BULPRISA
01-CC-000422,SOPHIA SCHOOL,NL,HER,"159 Abacon St., Calvario,","Meycauayan, Bulacan", , ,BULPRISA
01-CC-000154,GRACE CHRISTIAN ACADEDMY-STA. MARIA,NL,HER,"(Frmly: Grace LRNG.CTR.)Bulac,","Sta. Maria, Bulacan", , ,BULPRISA
01-CC-000312,NAZARENUS COLLEGE FOUNDATION,NL,HER,Saluysoy,"Meycauayan, Bulacan", , ,BULPRISA
01-CC-000424,SPIRIT OF JOY LEARNING CENTER,NL,HER,"Blk. 8 Lot 34, Leader St.,","Pleasant Hills Subd., SJDM, Bulacan", , ,
01-CC-000309,MOTHER THERESE C/K LEARNING CENTER,NL,HER,"114 Sandico St.,","Poblacion II, Marilao, Bulacan", , ,
01-CC-000551,SANTIAGO TRILLANA ACADEMY,NL,HER,,, , ,BULPRISA
01-CC-000449,ST. JEAN BAPTISTE ACADEMY,NL,HER,"Mont. Sch. Imm. Concepcion,","V. de Dios St., Baliuag, Bulacan", , ,BULPRISA
01-CC-000592,ST. MICHAEL SCHOOL OF MARILAO,NL,HER,Villa Regina,"Marilao, Bulacan", , ,
01-CC-000261,LKPBI MONTESSORI SCHOOL (LIGAS),NL,HER,Ligas,"Ligas, Malolos, Bulacan",, ,MACIPRISA
01-CC-000406,"SCH. OF ST. IGNATIUS, INC.",NL,HER,"Bigte,","Norzagaray, Bulacan", , ,BULPRISA
01-CC-000216,JIL CHRISTIAN COLL.-PLARIDEL,NL,HER,Poblacion,"Plaridel, Bulacan", , ,
01-CC-000202,INT'L UNIV. FOUNDATION (IUF),NL,HER,"2nd Floor Panilina, Banga,","Meycauayan, Bulacan", , ,
01-CC-000104,DONA TRINIDAD MENDOZA INSTITUTE,NL,HER,"Daan Estacion, (near Church)","San Jose, Bulacan, Bulacan", , ,BULPRISA
01-CC-000033,BULACAN CENTRAL CHRISTIAN SCHOOL,NL,HER,"39 Bagumbayan,","Bulacan, Bulacan", , ,BULPRISA
01-CC-000546,ST. EZEKIEL MORENO SCHOOL,NL,HER,"Phase 7-G, Blk 20 Lot 27-30","Grand Royal, Malolos, Bulacan",, ,BULPRISA / MACIPRISA
01-CC-000548,SMART STARTERS MONTESSORI,NL,HER,"Area III, Brgy. Graceville,","San Jose del Monte, Bulacan", , ,
01-CC-000390,SAN LORENZO RUIZ MONT.-BULACAN,NL,HER,"Matungaw,","Bulacan, Bulacan", , ,
01-CC-000201,INT'L MONTESSORI SCHOOL,NL,HER,"Rufina Homes, Sta. Isabel","Malolos, Bulacan",, ,MACIPRISA
01-CC-000387,SAN ISIDRO-SAN ROQUE ACADEMY,NL,HER,"#5 Daungan St, Malhacan,","Meycauayan, Bulacan", , ,
01-CC-000483,ST. PAUL SCH.-SAN ILDEFONSO,NL,HER,Poblacion,"San Ildefonso, Bulacan",SPC,,BULPRISA
01-CC-000161,ANGELICUM ACADEMY OF MARILAO,NL,HER,(GUARDIAN ANGEL L.C.)-Heritage,"Homes, Loma de Gato, Marilao, Bulacan", , ,
01-CC-000049,CHANNEL OF DREAMS SCHOOL,NL,HER,"Caypombo,","Sta. Maria, Bulacan", , ,
01-CC-000080,COL. DE SANTISSIMA TRINIDAD OF BULACAN,NL,HER,"Lalakhan,","Sta. Maria, Bulacan", , ,
01-CC-000148,GOLDEN VALUES ACADEMY OF STA. MARIA,NL,HER,"Km. 39 Tierra Pulong Buhangin,","Sta. Maria, Bulacan", , ,
01-CC-000120,FAITH OF MARY ACADEMY,NL,HER,Frmly: Kids Horizon L.C.-Metrogate,"Genesis Ave.Pandayan,Meycauayan, Bulacan", , ,
01-CC-000023,BALIUAG CROSS & FLAME ACADEMY,NL,HER,"B.S. Aquino Ave.,","Bagong Nayon, Baliuag, Bulacan", , ,BULPRISA
01-CC-000184,HOLY LAMB ACADEMY,NL,HER,"Bo. Patubig,","Marilao, Bulacan", , ,
01-CC-000199,IMM. HEART OF MARY SCHOOL-SJDM,NL,HER,Lourdes Grotto,"San Jose Del Monte, Bulacan",SFSC, ,BULPRISA
01-CC-000497,STA. MONICA LEARNING CENTER,NL,HER,"Sto. Nino,","Plaridel, Bulacan", , ,BULPRISA
01-CC-000290,MAYI MONTESSORI SCHOOL,NL,HER,"Rhodonite St., Rocka Village II,","Tabang, Plaridel, Bulacan", , ,
01-CC-000275,MA. KATRINA SCHOOL,NL,HER,"#10 Mendoza St., Saog,","Marilao, Bulacan", , ,
01-CC-000087,CORINTHIAN SCHOOL,NL,HER,"Azicate Homes, Lolomboy,","Bocaue, Bulacan", , ,
01-CC-000458,ST. JOSEPH SCHOOL OF BALIUAG,NL,HER,"J.P. Rizal St., Sta. Barbara,","Baliuag, Bulacan", , ,BULPRISA
01-CC-000556,"MELODY PLAINS ACADEMY, INC.",NL,HER,,, , ,Family Business
01-CC-000513,SYSTEM TECHNOLOGY INST. ACAD.-MALOLOS,NL,HER,"18-A Mabini St., Mojon,","Malolos City, Bulacan",, ,BULPRISA / MACIPRISA
01-CC-000574,GOD'S LOVE CHILDREN'S ADVANCEMENT CTR.,NL,HER,"15 Guillerma Village, Old Sta. Rita,","San Miguel, Bulacan", , ,
01-CC-000501,STELLA ORIENTIS SCHOOL,NL,HER,"Menzyland Subd., Mojon,","Malolos, Bulacan",, ,BULPRISA / MACIPRISA
01-CC-000547,ST. THOMAS SCHOOL OF CAYPOMBO,NL,HER,"B-22 L-7 & 9, Brighthomes, Meadows","Brgy. Caypombo,Sta. Maria,Bulacan", , ,BULPRISA
01-CC-000412,SHALOM CHRISTIAN ACADEMY,NL,HER,"IEMELIF Church, Gatbuca,","Calumpit, Bulacan", , ,
01-CC-000347,OUR LORD'S GLORY ACADEMY,NL,HER,"Cruzaders St., Ph-I, Pleasant Hills,","San Jose del Monte, Bulacan", , ,
01-CC-000231,KIDS ZONE ACADEMY,NL,HER,"B-5 L-56 Valero St., Villa Grande Subd.,","Lambakin, Marilao, Bulacan", , ,
01-CC-000169,HARVESTERS MISSION CHRISTIAN ACADEMY,NL,HER,"Brgy. Longos,","Calumpit, Bulacan",, ,MACIPRISA
01-CC-000533,VICRIS SCHOOL,NL,HER,"A. Mabini St., Tibag,","Baliuag, Bulacan", , ,BULPRISA
01-CC-000554,ESCUELA DE ANGELA MARICI,NL,HER,,, , ,BULPRISA
01-CC-000375,ROSELAND TUTORIAL LEARNING CENTER,NL,HER,"Karenville Subd., Frenza,","Marilao, Bulacan", , ,
01-CC-000557,ST. FRANCIS DE ASSISI SCH. OF MULTIPLE,NL,HER,Evergreen Ave. B14 L19 Evergreen Hts.,"San Jose Del MOnte, Bulacan", , ,
01-CC-000197,IMM. HEART OF MARY INTEG. SCH.,NL,HER,"Km 38, Pulong Buhangin,","Sta. Maria, Bulacan", , ,
01-CC-000594,GOLDEN MINDS ACADEMY,NL,HER,"173 T. Garcia St., Tabanga","Guiguinto, Bulacan", , ,
01-CC-000277,MA. THERESA MONTESSORI SCHOOL,NL,HER,"Bulihan,","Malolos, Bulacan", , ,
01-CC-000487,ST. STEPHEN SCHOOL,NL,HER,"#6234 Dona Juanita Subd.,","Bambang, Bulacan, Bulacan", , ,BULPRISA
01-CC-000604,SOLID GROUND SCHOOL,NL,HER,Rocka Village 1,"Plaridel, Bulacan",,,
01-CC-000564,"WAMINAL ACHIEVERS ACADEMY, INC",NL,HER,,, , ,BULPRISA
01-CC-000268,LORD'S VINE MONTESSORI,NL,HER,"(Kiddie Star Mont.) Metrogate II,","Heritage Homes, Marilao, Bulacan", , ,
01-CC-000553,DE LA SALLE MONTESSORI INTERNATIONAL,NL,HER,,,, ,MACIPRISA
01-CC-000021,BALAGTAS MONTESSORI SCHOOL,NL,HER,"Panginay,","Balagtas, Bulacan", , ,
01-CC-000164,HAGONOY ECUMENICAL SCHOOL,NL,HER,"Rizal St., San Sebastian,","Hagonoy, Bulacan", , ,BULPRISA
01-CC-000603,"HOLY TRINITY SCHOOL OF OBANDO, INC",NL,HER,"Lawa, Obando",Bulacan,,,
01-CC-000495,STA. FAUSTINA ACADEMY,NL,HER,Prenza,"Prenza, Marilao, Bulacan", , ,
01-CC-000595,TRINITAS COLLEGE,NL,HER,Sto. Nino,"Meycauayan, Bulacan",,,
01-CC-000082,COL. DE STA. MARIA,NL,HER,"Brgy. Bagbayuin,","Sta. Maria, Bulacan", , ,BULPRISA
01-CC-000354,PERPETUAL HELP ACADEMY OF PALMERA,NL,HER,"B-20 L-17 Carissa 3-A, Palmera","San Jose de Monte, Bulacan", , ,
01-CC-000591,JOYFUL TOUCH LEARNING CENTER,NL,HER,,, , ,
01-CC-000559,GLOBAL SEED SCIENCE SCHOOL,NL,HER,"Tindalo St., Sta. Clara,","Sta. Maria, Bulacan", , ,
